,name,github_id,description,category,github_url,homepage,license,created_at,updated_at,last_commit_pushed_at,commit_count,recent_commit_count,fork_count,watchers_count,pr_count,open_issue_count,closed_issue_count,star_count,latest_stable_release_published_at,latest_stable_release_number,github_release_downloads,monthly_downloads,release_count,contributor_count,projectrank,show,projectrank_placing,dependent_project_count,github_dependent_project_count,trending,updated_github_id,pypi_id,pypi_url,pypi_monthly_downloads
179,tumf/mcp-text-editor,tumf/mcp-text-editor,A line-oriented text file editor. Optimized for LLM tools with efficient partial file access to minimize token usage.,developer-tools,https://github.com/tumf/mcp-text-editor,https://github.com/tumf/mcp-text-editor,MIT,2024-12-11 10:12:28,2026-03-17 22:06:05,2026-03-17 22:06:02,240.0,2.0,21.0,1.0,12.0,1.0,7.0,188.0,2026-01-05 04:18:58,1.2.0,,,3.0,12.0,14,True,2.0,3.0,3.0,,,,,
180,tinyfish-io/agentql-mcp,tinyfish-io/agentql-mcp,MCP server that provides AgentQLs data extraction capabilities.,search-data-extraction,https://github.com/tinyfish-io/agentql-mcp,https://github.com/tinyfish-io/agentql-mcp,MIT,2024-12-21 01:12:55,2026-05-19 08:35:51,2026-05-19 08:35:51,98.0,22.0,39.0,9.0,43.0,2.0,,170.0,2025-03-13 00:38:37,1.0.0,,,1.0,6.0,14,True,2.0,5.0,5.0,,,,,
181,pydantic/logfire-mcp,pydantic/logfire-mcp,Provides access to OpenTelemetry traces and metrics through Logfire.,monitoring,https://github.com/pydantic/logfire-mcp,https://github.com/pydantic/logfire-mcp,MIT,2025-03-06 12:26:11,2026-03-24 08:35:44,2026-03-24 08:35:42,60.0,5.0,25.0,4.0,45.0,,14.0,161.0,2026-01-05 19:58:29,0.8.0,,,16.0,10.0,14,True,3.0,,,,,,,
182,mahdin75/gis-mcp,mahdin75/gis-mcp,A Model Context Protocol (MCP) server implementation that connects Large Language Models (LLMs) to GIS operations..,location-services,https://github.com/mahdin75/gis-mcp,https://github.com/mahdin75/gis-mcp,MIT,2025-05-07 14:21:57,2025-12-21 11:05:18,2025-12-18 07:02:12,249.0,,42.0,4.0,19.0,3.0,11.0,155.0,2025-12-21 11:05:18,0.14.0,,,14.0,12.0,14,True,1.0,,,,,,,
183,weibaohui/kom,weibaohui/kom,Provides MCP multi-cluster Kubernetes management and operations. It can be integrated as an SDK into your own project..,cloud-platforms,https://github.com/weibaohui/kom,https://github.com/weibaohui/kom,MIT,2024-10-21 12:24:05,2026-02-06 14:25:33,2026-02-06 14:25:33,1060.0,,34.0,4.0,72.0,3.0,2.0,147.0,2026-01-24 11:55:47,0.2.71,,,100.0,6.0,14,True,3.0,11.0,11.0,,,,,
184,narumiruna/yfinance-mcp,narumiruna/yfinance-mcp,An MCP server that uses yfinance to obtain information from Yahoo Finance.,finance-and-fintech,https://github.com/narumiruna/yfinance-mcp,https://github.com/narumiruna/yfinance-mcp,MIT,2025-03-30 11:35:19,2026-05-16 04:55:57,2026-05-16 04:55:56,372.0,86.0,50.0,2.0,122.0,,3.0,137.0,2026-05-16 04:56:06,0.11.3,2.0,2.0,2.0,7.0,14,True,2.0,,,3.0,,,,
185,mikechao/brave-search-mcp,mikechao/brave-search-mcp,"Web, Image, News, Video, and Local Point of Interest search capabilities using Braves Search API.",search-data-extraction,https://github.com/mikechao/brave-search-mcp,https://github.com/mikechao/brave-search-mcp,GPL-3.0,2025-04-02 19:15:47,2026-03-30 18:36:55,2026-03-30 18:36:50,536.0,129.0,19.0,2.0,5.0,,,117.0,2026-03-02 19:49:40,2.1.0,138.0,10.0,13.0,4.0,14,True,2.0,5.0,5.0,,,,,
186,StacklokLabs/mkp,StacklokLabs/mkp,MKP is a Model Context Protocol (MCP) server for Kubernetes that allows LLM-powered applications to interact with..,cloud-platforms,https://github.com/StacklokLabs/mkp,https://github.com/StacklokLabs/mkp,Apache-2.0,2025-04-23 12:47:32,2026-05-15 13:34:06,2026-05-04 14:10:13,189.0,18.0,7.0,3.0,146.0,4.0,18.0,57.0,2026-04-09 11:52:24,0.4.0,,,18.0,10.0,14,True,3.0,,,,,,,
187,21st-dev/magic-mcp,21st-dev/magic-mcp,Create crafted UI components inspired by the best 21st.dev design engineers.,developer-tools,https://github.com/21st-dev/magic-mcp,https://github.com/21st-dev/magic-mcp,,2025-02-19 13:17:50,2026-02-17 04:50:55,2026-02-17 04:50:55,77.0,,339.0,22.0,19.0,28.0,12.0,4889.0,,,,,,7.0,13,True,2.0,14.0,14.0,,,,,
188,kontext-dev/browser-use-mcp-server,kontext-dev/browser-use-mcp-server,browser-use packaged as an MCP server with SSE transport. includes a dockerfile to run chromium in docker + a vnc..,browser-automation,https://github.com/kontext-security/browser-use-mcp-server,https://github.com/kontext-security/browser-use-mcp-server,MIT,2025-03-06 09:47:03,2025-07-10 09:57:23,2025-07-10 09:57:18,161.0,,107.0,4.0,33.0,14.0,10.0,822.0,2025-04-15 23:37:23,1.0.3,175.0,13.0,4.0,7.0,13,True,3.0,,,,kontext-security/browser-use-mcp-server,,,
189,jasonjmcghee/claude-debugs-for-you,jasonjmcghee/claude-debugs-for-you,An MCP Server and VS Code Extension which enables (language agnostic) automatic debugging via breakpoints and..,developer-tools,https://github.com/jasonjmcghee/claude-debugs-for-you,https://github.com/jasonjmcghee/claude-debugs-for-you,MIT,2025-01-17 05:54:24,2025-12-20 01:43:03,2025-12-20 01:42:51,88.0,,46.0,8.0,21.0,8.0,13.0,510.0,2025-12-20 17:18:57,0.1.2,270.0,16.0,9.0,5.0,13,True,2.0,,,,,,,
190,PV-Bhat/vibe-check-mcp-server,PV-Bhat/vibe-check-mcp-server,An MCP server that prevents cascading errors and scope creep by calling a Vibe-check agent to ensure user alignment.,other-tools-and-integrations,https://github.com/PV-Bhat/vibe-check-mcp-server,https://github.com/PV-Bhat/vibe-check-mcp-server,MIT,2025-03-22 09:33:08,2026-03-30 17:06:12,2026-03-30 17:06:12,270.0,2.0,63.0,4.0,75.0,6.0,11.0,486.0,2025-11-06 16:59:40,2.7.6,,,7.0,11.0,13,True,3.0,,,,,,,
191,r-huijts/strava-mcp,r-huijts/strava-mcp,"A Model Context Protocol (MCP) server that connects to Strava API, providing tools to access Strava data through LLMs.",sports,https://github.com/r-huijts/strava-mcp,https://github.com/r-huijts/strava-mcp,MIT,2025-04-06 14:02:48,2026-04-07 09:32:24,2026-04-07 09:32:24,100.0,22.0,77.0,12.0,35.0,7.0,8.0,402.0,,,,,,21.0,13,True,1.0,,,,,,,
192,hyperb1iss/droidmind,hyperb1iss/droidmind,"Control Android devices with AI through MCP, enabling device control, debugging, system analysis, and UI automation..",developer-tools,https://github.com/hyperb1iss/droidmind,https://github.com/hyperb1iss/droidmind,Apache-2.0,2025-03-02 10:46:15,2026-01-07 06:37:48,2026-01-07 06:36:07,85.0,,54.0,5.0,3.0,6.0,6.0,399.0,2026-01-07 06:37:56,0.4.0,,,2.0,,13,True,2.0,,,,,,,
193,juehang/vscode-mcp-server,juehang/vscode-mcp-server,"A MCP Server that allows AI such as Claude to read from the directory structure in a VS Code workspace, see problems..",coding-agents,https://github.com/juehang/vscode-mcp-server,https://github.com/juehang/vscode-mcp-server,MIT,2025-04-21 20:46:42,2026-01-07 15:40:49,2026-01-07 15:39:24,69.0,,72.0,6.0,10.0,6.0,6.0,365.0,2026-01-07 15:40:49,0.4.0,,,12.0,4.0,13,True,3.0,,,,,,,
194,nwiizo/tfmcp,nwiizo/tfmcp,"A Terraform MCP server allowing AI assistants to manage and operate Terraform environments, enabling reading..",cloud-platforms,https://github.com/nwiizo/tfmcp,https://github.com/nwiizo/tfmcp,MIT,2025-03-08 14:10:29,2026-03-26 07:29:30,2026-03-26 07:29:12,58.0,2.0,28.0,9.0,8.0,,6.0,364.0,2026-03-26 07:29:30,0.2.0,,,5.0,3.0,13,True,3.0,,,,,,,
195,fosdickio/binary_ninja_mcp,fosdickio/binary_ninja_mcp,"A Binary Ninja plugin, MCP server, and bridge that seamlessly integrates Binary Ninja with your favorite MCP client...",security,https://github.com/fosdickio/binary_ninja_mcp,https://github.com/fosdickio/binary_ninja_mcp,GPL-3.0,2025-03-28 22:07:55,2026-04-05 19:38:07,2026-04-05 19:38:07,50.0,3.0,73.0,5.0,33.0,24.0,19.0,353.0,2026-03-22 15:07:12,1.2.1,,,14.0,8.0,13,True,3.0,,,,,,,
196,SDGLBL/mcp-claude-code,SDGLBL/mcp-claude-code,"An implementation of Claude Code capabilities using MCP, enabling AI code understanding, modification, and project..",developer-tools,https://github.com/SDGLBL/mcp-claude-code,https://github.com/SDGLBL/mcp-claude-code,MIT,2025-03-18 10:55:31,2025-08-29 13:41:08,2025-08-29 13:20:52,291.0,,35.0,1.0,10.0,2.0,16.0,301.0,2025-08-29 13:43:16,0.5.1,345.0,24.0,37.0,4.0,13,True,2.0,,,,,,,
197,cyberchitta/llm-context.py,cyberchitta/llm-context.py,Share code context with LLMs via MCP or clipboard.,file-systems,https://github.com/cyberchitta/llm-context.py,https://github.com/cyberchitta/llm-context.py,Apache-2.0,2024-04-20 15:51:14,2026-05-17 15:36:59,2026-05-17 15:36:54,705.0,13.0,23.0,8.0,14.0,3.0,3.0,300.0,,,,,,3.0,13,True,3.0,,,,,,,
198,carterlasalle/mac_messages_mcp,carterlasalle/mac_messages_mcp,"An MCP server that securely interfaces with your iMessage database via the Model Context Protocol (MCP), allowing LLMs..",communication,https://github.com/carterlasalle/mac_messages_mcp,https://github.com/carterlasalle/mac_messages_mcp,MIT,2025-03-13 04:24:07,2026-05-10 20:13:28,2026-05-10 20:13:27,126.0,61.0,43.0,6.0,35.0,,13.0,286.0,,,,,,14.0,13,True,3.0,,,,,,,
199,eyalzh/browser-control-mcp,eyalzh/browser-control-mcp,An MCP server paired with a browser extension that enables LLM clients to control the users browser (Firefox).,browser-automation,https://github.com/eyalzh/browser-control-mcp,https://github.com/eyalzh/browser-control-mcp,MIT,2025-03-27 16:16:33,2026-03-31 07:11:27,2026-03-31 07:11:27,72.0,1.0,65.0,2.0,33.0,10.0,7.0,285.0,2025-07-29 09:09:43,1.5.1,6539.0,653.0,6.0,3.0,13,True,3.0,,,,,,,
200,ariadng/metatrader-mcp-server,ariadng/metatrader-mcp-server,Enable AI LLMs to execute trades using MetaTrader 5 platform.,finance-and-fintech,https://github.com/ariadng/metatrader-mcp-server,https://github.com/ariadng/metatrader-mcp-server,MIT,2025-04-10 09:15:15,2026-03-28 18:39:29,2026-03-28 18:39:17,141.0,14.0,87.0,9.0,10.0,3.0,9.0,244.0,2025-04-23 18:25:00,0.2.3,49.0,3.0,2.0,2.0,13,True,2.0,,,,,,,
201,hustcc/mcp-echarts,hustcc/mcp-echarts,Generate visual charts using Apache ECharts with AI MCP dynamically.,customer-data-platforms,https://github.com/hustcc/mcp-echarts,https://github.com/hustcc/mcp-echarts,MIT,2025-07-10 01:29:54,2026-01-30 15:36:37,2026-01-30 15:34:16,29.0,,35.0,3.0,27.0,2.0,16.0,231.0,2026-01-30 15:36:37,0.7.1,,,9.0,11.0,13,True,3.0,,,,,,,
202,alexei-led/k8s-mcp-server,alexei-led/k8s-mcp-server,"A lightweight yet robust server that empowers AI assistants to securely execute Kubernetes CLI commands (kubectl,..",cloud-platforms,https://github.com/alexei-led/k8s-mcp-server,https://github.com/alexei-led/k8s-mcp-server,MIT,2025-03-27 16:14:32,2026-02-27 15:41:55,2026-02-27 15:40:39,111.0,6.0,39.0,3.0,10.0,,12.0,209.0,2026-02-27 15:42:19,1.4.2,,,6.0,,13,True,3.0,,,,,,,
203,furey/mongodb-lens,furey/mongodb-lens,MongoDB Lens: Full Featured MCP Server for MongoDB Databases.,databases,https://github.com/furey/mongodb-lens,https://github.com/furey/mongodb-lens,MIT,2025-03-09 05:39:54,2025-04-23 00:44:12,2025-04-23 00:44:03,448.0,,29.0,7.0,7.0,,,201.0,2025-04-23 00:44:33,9.1.4,,,25.0,3.0,13,False,3.0,2.0,2.0,,,,,
204,fatwang2/search1api-mcp,fatwang2/search1api-mcp,Search via search1api (requires paid API key).,search-data-extraction,https://github.com/fatwang2/search1api-mcp,https://github.com/fatwang2/search1api-mcp,MIT,2024-11-26 09:03:56,2026-03-13 04:23:25,2026-03-13 04:23:08,74.0,9.0,38.0,3.0,9.0,1.0,4.0,172.0,2025-03-28 13:48:36,0.1.8,,,5.0,2.0,13,True,2.0,4.0,4.0,,,,,
205,yangkyeongmo/mcp-server-apache-airflow,yangkyeongmo/mcp-server-apache-airflow,MCP server that connects to Apache Airflow using official client.,developer-tools,https://github.com/yangkyeongmo/mcp-server-apache-airflow,https://github.com/yangkyeongmo/mcp-server-apache-airflow,MIT,2025-02-13 04:09:06,2026-03-03 13:24:59,2026-03-03 12:17:51,121.0,1.0,43.0,8.0,35.0,5.0,15.0,165.0,2026-02-06 12:47:49,0.2.10,,,7.0,12.0,13,True,2.0,,,,,,,
206,janreges/ai-distiller,janreges/ai-distiller,"Extracts essential code structure from large codebases into AI-digestible format, helping AI agents write code that..",developer-tools,https://github.com/janreges/ai-distiller,https://github.com/janreges/ai-distiller,MIT,2025-06-13 17:02:27,2026-03-16 23:46:24,2026-03-16 23:46:22,269.0,1.0,17.0,1.0,2.0,7.0,3.0,156.0,2025-06-21 09:36:09,1.3.1,2302.0,209.0,3.0,,13,True,2.0,,,,,,,
207,silenceper/mcp-k8s,silenceper/mcp-k8s,MCP-K8S is an AI-driven Kubernetes resource management tool that allows users to operate any resources in Kubernetes..,cloud-platforms,https://github.com/silenceper/mcp-k8s,https://github.com/silenceper/mcp-k8s,Apache-2.0,2025-04-03 08:56:13,2026-04-12 13:50:39,2026-04-12 13:50:31,76.0,6.0,28.0,2.0,25.0,,3.0,146.0,2026-01-15 03:57:39,2.0.1,494.0,38.0,8.0,7.0,13,True,3.0,,,,,,,
208,LucasHild/mcp-server-bigquery,LucasHild/mcp-server-bigquery,BigQuery database integration with schema inspection and query capabilities.,databases,https://github.com/LucasHild/mcp-server-bigquery,https://github.com/LucasHild/mcp-server-bigquery,MIT,2024-12-03 18:09:19,2026-03-26 13:57:09,2026-02-07 08:24:57,24.0,,36.0,3.0,24.0,3.0,7.0,126.0,2026-02-07 08:29:04,0.3.2,,,2.0,5.0,13,True,3.0,,,,,,,
209,nkapila6/mcp-local-rag,nkapila6/mcp-local-rag,primitive RAG-like web search model context protocol (MCP) server that runs locally. No APIs needed.,search-data-extraction,https://github.com/nkapila6/mcp-local-rag,https://github.com/nkapila6/mcp-local-rag,MIT,2025-03-13 09:20:19,2026-05-18 03:39:53,2026-05-18 03:39:45,71.0,9.0,21.0,3.0,83.0,5.0,3.0,126.0,2026-04-04 06:30:31,1.0.3,,,3.0,5.0,13,True,2.0,,,,,,,
210,aliyun/alibaba-cloud-ops-mcp-server,aliyun/alibaba-cloud-ops-mcp-server,"A MCP server that enables AI assistants to operation resources on Alibaba Cloud, supporting ECS, Cloud Monitor, OOS..",cloud-platforms,https://github.com/aliyun/alibaba-cloud-ops-mcp-server,https://github.com/aliyun/alibaba-cloud-ops-mcp-server,Apache-2.0,2025-04-17 06:17:10,2026-03-16 15:21:52,2026-02-04 09:18:40,135.0,,34.0,3.0,69.0,,4.0,115.0,2026-03-09 03:21:34,0.9.27,,,5.0,4.0,13,True,3.0,2.0,2.0,,,,,
211,translated/lara-mcp,translated/lara-mcp,"MCP Server for Lara Translate API, enabling powerful translation capabilities with support for language detection and..",translation-services,https://github.com/translated/lara-mcp,https://github.com/translated/lara-mcp,MIT,2025-03-31 05:10:30,2026-05-15 09:39:21,2026-05-15 09:38:02,45.0,10.0,18.0,8.0,36.0,1.0,3.0,86.0,2026-05-15 09:39:21,1.0.3,,,4.0,4.0,13,True,1.0,,,,,,,
212,alchemyplatform/alchemy-mcp-server,alchemyplatform/alchemy-mcp-server,Allow AI agents to interact with Alchemys blockchain APIs.,finance-and-fintech,https://github.com/alchemyplatform/alchemy-mcp-server,https://github.com/alchemyplatform/alchemy-mcp-server,MIT,2025-03-27 17:08:08,2026-04-17 18:43:46,2026-04-09 00:11:00,113.0,40.0,31.0,5.0,40.0,5.0,2.0,85.0,2026-03-26 19:10:10,0.3.0,,,9.0,6.0,13,True,2.0,,,,,,,
213,refreshdotdev/web-eval-agent,refreshdotdev/web-eval-agent,An MCP Server that autonomously debugs web applications with browser-use browser agents.,browser-automation,https://github.com/refreshdotdev/web-eval-agent,https://github.com/refreshdotdev/web-eval-agent,Apache-2.0,2025-04-01 23:40:56,2026-02-11 14:55:42,2025-11-22 06:52:37,209.0,,108.0,7.0,37.0,3.0,12.0,1239.0,,,,,,7.0,12,True,3.0,,,,,,,
214,JetBrains/mcp-jetbrains,JetBrains/mcp-jetbrains,Connect to JetBrains IDE.,developer-tools,https://github.com/JetBrains/mcp-jetbrains,https://github.com/JetBrains/mcp-jetbrains,Apache-2.0,2024-12-09 11:50:21,2026-01-07 16:21:45,2025-08-18 09:34:55,47.0,,67.0,8.0,10.0,37.0,37.0,953.0,2025-07-01 10:07:28,dxt-v1.0.2,107.0,6.0,22.0,6.0,12,True,3.0,,,,,,,
215,semgrep/mcp,semgrep/mcp,Allow AI agents to scan code for security vulnerabilites using Semgrep.,security,https://github.com/semgrep/mcp,https://github.com/semgrep/mcp,MIT,2025-03-17 20:08:14,2025-10-28 22:32:31,2025-10-28 22:32:29,353.0,,55.0,5.0,168.0,12.0,17.0,666.0,2025-06-24 15:38:18,0.4.0,,,1.0,19.0,12,True,3.0,,,,,,,
216,microsoft/mcp-gateway,microsoft/mcp-gateway,"A reverse proxy and management layer for MCP servers, enabling scalable, session-aware routing and lifecycle..",aggregators,https://github.com/microsoft/mcp-gateway,https://github.com/microsoft/mcp-gateway,MIT,2025-05-14 18:16:35,2026-05-18 17:11:40,2026-05-18 17:11:40,41.0,6.0,67.0,13.0,47.0,8.0,23.0,640.0,,,,,,6.0,12,True,3.0,,,,,,,
217,etsd-tech/mcp-pointer,etsd-tech/mcp-pointer,"Visual DOM element selector for agentic coding tools. Chrome extension + MCP server bridge for Claude Code, Cursor,..",developer-tools,https://github.com/etsd-tech/mcp-pointer,https://github.com/etsd-tech/mcp-pointer,MIT,2025-09-01 21:59:15,2025-11-12 15:12:43,2025-11-12 15:11:56,121.0,,55.0,3.0,17.0,2.0,,576.0,2025-11-12 15:12:43,0.6.0,111.0,13.0,16.0,4.0,12,True,3.0,,,,,,,
218,ferrislucas/iterm-mcp,ferrislucas/iterm-mcp,A Model Context Protocol server that provides access to iTerm. You can run commands and ask questions about what you..,command-line,https://github.com/ferrislucas/iterm-mcp,https://github.com/ferrislucas/iterm-mcp,MIT,2025-01-09 04:49:23,2025-09-20 17:31:44,2025-09-20 17:26:11,80.0,,62.0,1.0,24.0,6.0,10.0,556.0,2025-09-20 17:32:14,1.2.6,,,12.0,7.0,12,True,3.0,3.0,3.0,,,,,
219,chroma-core/chroma-mcp,chroma-core/chroma-mcp,Chroma MCP server to access local and cloud Chroma instances for retrieval capabilities.,databases,https://github.com/chroma-core/chroma-mcp,https://github.com/chroma-core/chroma-mcp,Apache-2.0,2025-02-11 00:23:22,2025-09-17 20:20:13,2025-09-17 20:20:13,57.0,,108.0,6.0,38.0,14.0,14.0,548.0,2025-08-14 15:33:11,0.2.6,165.0,12.0,7.0,6.0,12,True,3.0,,,,,,,
220,vivekVells/mcp-pandoc,vivekVells/mcp-pandoc,"MCP server for seamless document format conversion using Pandoc, supporting Markdown, HTML, PDF, DOCX (.docx), csv and..",developer-tools,https://github.com/vivekVells/mcp-pandoc,https://github.com/vivekVells/mcp-pandoc,MIT,2024-12-08 18:42:49,2025-09-16 02:52:43,2025-09-16 02:52:43,86.0,,55.0,4.0,15.0,6.0,14.0,537.0,2025-08-30 01:27:22,0.8.1,,,5.0,9.0,12,True,3.0,,,,,,,
221,tufantunc/ssh-mcp,tufantunc/ssh-mcp,MCP server exposing SSH control for Linux and Windows servers via Model Context Protocol. Securely execute remote..,command-line,https://github.com/tufantunc/ssh-mcp,https://github.com/tufantunc/ssh-mcp,MIT,2025-04-26 21:07:32,2026-01-03 19:21:40,2026-01-03 19:20:16,41.0,,68.0,1.0,27.0,12.0,7.0,464.0,2026-01-03 19:21:16,1.5.0,,,17.0,3.0,12,True,3.0,2.0,2.0,,,,,
222,zinja-coder/apktool-mcp-server,zinja-coder/apktool-mcp-server,APKTool MCP Server is a MCP server for the Apk Tool to provide automation in reverse engineering of Android APKs.,security,https://github.com/zinja-coder/apktool-mcp-server,https://github.com/zinja-coder/apktool-mcp-server,Apache-2.0,2025-04-19 19:20:05,2026-04-25 11:20:00,2026-04-25 11:07:45,51.0,2.0,43.0,2.0,6.0,1.0,1.0,445.0,2026-04-25 11:20:00,3.0.1,1324.0,101.0,5.0,3.0,12,True,3.0,,,,,,,
223,evalstate/mcp-hfspace,evalstate/mcp-hfspace,"Use HuggingFace Spaces directly from Claude. Use Open Source Image Generation, Chat, Vision tasks and more. Supports..",other-tools-and-integrations,https://github.com/evalstate/mcp-hfspace,https://github.com/evalstate/mcp-hfspace,MIT,2024-12-03 17:39:34,2025-06-13 17:05:31,2025-06-13 17:05:31,155.0,,56.0,5.0,14.0,10.0,6.0,388.0,2025-04-21 06:49:12,0.54,,,8.0,7.0,12,True,3.0,,,,,,,
224,blurrah/mcp-graphql,blurrah/mcp-graphql,Allows the AI to query GraphQL servers.,other-tools-and-integrations,https://github.com/blurrah/mcp-graphql,https://github.com/blurrah/mcp-graphql,MIT,2024-12-21 14:05:45,2025-09-08 14:28:14,2025-07-31 20:14:17,80.0,,57.0,3.0,20.0,6.0,11.0,386.0,2025-05-27 19:57:47,2.0.4,129.0,7.0,22.0,7.0,12,True,3.0,2.0,2.0,,,,,
225,kagisearch/kagimcp,kagisearch/kagimcp,Official Kagi Search MCP Server.,search-data-extraction,https://github.com/kagisearch/kagimcp,https://github.com/kagisearch/kagimcp,MIT,2024-12-13 02:41:16,2026-05-16 00:31:37,2026-05-15 19:29:05,41.0,39.0,37.0,11.0,15.0,3.0,11.0,385.0,,,,,,5.0,12,True,2.0,,,,,,,
226,graphlit/graphlit-mcp-server,graphlit/graphlit-mcp-server,"Ingest anything from Slack, Discord, websites, Google Drive, Linear or GitHub into a Graphlit project - and then..",knowledge-and-memory,https://github.com/graphlit/graphlit-mcp-server,https://github.com/graphlit/graphlit-mcp-server,MIT,2025-03-01 08:02:03,2026-01-12 19:10:52,2026-01-12 19:10:47,261.0,,51.0,4.0,7.0,1.0,,375.0,,,,,,4.0,12,True,3.0,5.0,5.0,,,,,
227,ferdousbhai/investor-agent,ferdousbhai/investor-agent,Yahoo Finance integration to fetch stock market data including options recommendations.,finance-and-fintech,https://github.com/ferdousbhai/investor-agent,https://github.com/ferdousbhai/investor-agent,MIT,2025-02-21 06:20:12,2026-05-14 00:58:14,2026-05-14 00:58:12,86.0,32.0,53.0,4.0,6.0,,9.0,328.0,,,,,,6.0,12,True,2.0,,,,,,,
228,InditexTech/mcp-server-simulator-ios-idb,InditexTech/mcp-server-simulator-ios-idb,"A Model Context Protocol (MCP) server that enables LLMs to interact with iOS simulators (iPhone, iPad, etc.) through..",developer-tools,https://github.com/InditexTech/mcp-server-simulator-ios-idb,https://github.com/InditexTech/mcp-server-simulator-ios-idb,Apache-2.0,2025-03-18 11:11:28,2026-01-26 10:49:23,2025-09-02 10:59:43,39.0,,24.0,3.0,14.0,4.0,4.0,303.0,2025-04-02 14:17:03,1.0.1,,,2.0,7.0,12,True,3.0,,,,,,,
229,VikashLoomba/MCP-Server-Playwright,VikashLoomba/MCP-Server-Playwright,A Model Context Protocol server that provides browser automation capabilities using Playwright.,browser-automation,https://github.com/VikashLoomba/MCP-Server-Playwright,https://github.com/VikashLoomba/MCP-Server-Playwright,MIT,2024-12-02 08:15:20,2025-06-05 21:48:28,2025-06-05 21:48:28,75.0,,50.0,2.0,10.0,5.0,1.0,291.0,2025-01-24 07:03:52,1.2.1,,,15.0,5.0,12,True,3.0,17.0,17.0,,,,,
230,Govcraft/rust-docs-mcp-server,Govcraft/rust-docs-mcp-server,"Provides up-to-date documentation context for a specific Rust crate to LLMs via an MCP tool, using semantic search..",developer-tools,https://github.com/Govcraft/rust-docs-mcp-server,https://github.com/Govcraft/rust-docs-mcp-server,MIT,2025-03-26 00:15:21,2025-11-24 19:44:06,2025-11-24 19:44:06,78.0,,33.0,2.0,10.0,6.0,8.0,276.0,2025-05-08 03:13:07,1.3.1,598.0,42.0,14.0,4.0,12,True,3.0,,,,,,,
231,wenb1n-dev/mysql_mcp_server_pro,wenb1n-dev/mysql_mcp_server_pro,"Supports SSE, STDIO; not only limited to MySQLs CRUD functionality; also includes database exception analysis..",databases,https://github.com/wenb1n-dev/mysql_mcp_server_pro,https://github.com/wenb1n-dev/mysql_mcp_server_pro,MIT,2025-04-04 07:22:49,2025-08-28 13:50:15,2025-08-28 13:50:09,80.0,,43.0,4.0,1.0,14.0,29.0,243.0,2025-08-05 00:48:54,1.7.0,,,10.0,2.0,12,True,3.0,,,,,,,
232,XGenerationLab/xiyan_mcp_server,XGenerationLab/xiyan_mcp_server,"An MCP server that supports fetching data from a database using natural language queries, powered by XiyanSQL as the..",databases,https://github.com/XGenerationLab/xiyan_mcp_server,https://github.com/XGenerationLab/xiyan_mcp_server,Apache-2.0,2025-03-13 07:39:00,2026-02-11 09:41:44,2026-02-11 09:41:44,67.0,,47.0,10.0,6.0,10.0,4.0,236.0,2025-05-07 11:06:19,0.1.5,43.0,3.0,6.0,9.0,12,True,3.0,,,,,,,
233,zilliztech/mcp-server-milvus,zilliztech/mcp-server-milvus,"MCP Server for Milvus / Zilliz, making it possible to interact with your database.",databases,https://github.com/zilliztech/mcp-server-milvus,https://github.com/zilliztech/mcp-server-milvus,Apache-2.0,2025-03-06 02:10:40,2026-05-08 08:07:30,2026-05-08 08:07:11,42.0,7.0,66.0,6.0,49.0,2.0,21.0,232.0,,,,,,12.0,12,True,3.0,,,,,,,
234,mpeirone/zabbix-mcp-server,mpeirone/zabbix-mcp-server,"Zabbix integration for hosts, items, triggers, templates, problems, data and more.",monitoring,https://github.com/mpeirone/zabbix-mcp-server,https://github.com/mpeirone/zabbix-mcp-server,GPL-3.0,2025-06-22 22:47:06,2026-05-10 12:29:29,2026-05-10 12:28:51,33.0,5.0,68.0,4.0,25.0,1.0,12.0,214.0,2026-05-10 12:29:30,V2.0.0,,,4.0,6.0,12,True,3.0,,,,,,,
235,apify/mcp-server-rag-web-browser,apify/mcp-server-rag-web-browser,"An MCP server for Apifys open-source RAG Web Browser Actor to perform web searches, scrape URLs, and return content in..",search-data-extraction,https://github.com/apify/mcp-server-rag-web-browser,https://github.com/apify/mcp-server-rag-web-browser,Apache-2.0,2024-12-06 14:57:51,2026-05-19 20:20:12,2026-05-19 20:20:11,44.0,2.0,30.0,5.0,19.0,,5.0,203.0,2025-08-21 08:14:51,0.1.4,,,5.0,4.0,12,True,2.0,,,,,,,
236,andybrandt/mcp-simple-arxiv,andybrandt/mcp-simple-arxiv,MCP for LLM to search and read papers from arXiv.,search-data-extraction,https://github.com/andybrandt/mcp-simple-arxiv,https://github.com/andybrandt/mcp-simple-arxiv,MIT,2024-12-07 07:52:32,2026-02-19 10:18:35,2026-02-19 10:18:32,36.0,1.0,24.0,3.0,5.0,1.0,,193.0,,,,,,6.0,12,True,2.0,51.0,51.0,,,,,
237,armorwallet/armor-crypto-mcp,armorwallet/armor-crypto-mcp,"MCP to interface with multiple blockchains, staking, DeFi, swap, bridging, wallet management, DCA, Limit Orders, Coin..",finance-and-fintech,https://github.com/armorwallet/armor-crypto-mcp,https://github.com/armorwallet/armor-crypto-mcp,GPL-3.0,2025-03-22 12:05:35,2025-07-29 15:53:53,2025-05-27 10:02:34,184.0,,30.0,5.0,26.0,1.0,,182.0,2025-05-14 14:02:00,0.2.1,,,25.0,6.0,12,True,2.0,,,,,,,
238,ktanaka101/mcp-server-duckdb,ktanaka101/mcp-server-duckdb,DuckDB database integration with schema inspection and query capabilities.,databases,https://github.com/ktanaka101/mcp-server-duckdb,https://github.com/ktanaka101/mcp-server-duckdb,MIT,2024-11-30 14:25:37,2025-05-05 11:02:57,2025-05-05 10:54:44,53.0,,21.0,7.0,20.0,5.0,7.0,177.0,2025-05-05 11:00:02,1.1.0,,,9.0,4.0,12,True,3.0,1.0,1.0,,,,,
239,tumf/mcp-shell-server,tumf/mcp-shell-server,A secure shell command execution server implementing the Model Context Protocol (MCP).,command-line,https://github.com/tumf/mcp-shell-server,https://github.com/tumf/mcp-shell-server,MIT,2024-12-10 13:09:04,2026-04-02 03:44:19,2026-04-02 01:35:02,222.0,2.0,43.0,2.0,27.0,2.0,1.0,174.0,2024-12-23 00:21:09,1.0.3,,,2.0,11.0,12,True,3.0,3.0,3.0,,,,,
