,name,github_id,description,category,github_url,homepage,license,created_at,updated_at,last_commit_pushed_at,commit_count,recent_commit_count,fork_count,watchers_count,pr_count,open_issue_count,closed_issue_count,star_count,latest_stable_release_published_at,latest_stable_release_number,github_release_downloads,monthly_downloads,release_count,contributor_count,projectrank,show,projectrank_placing,dependent_project_count,github_dependent_project_count,trending,updated_github_id,pypi_id,pypi_url,pypi_monthly_downloads
118,caol64/wenyan-mcp,caol64/wenyan-mcp,"Wenyan MCP Server, which lets AI automatically format Markdown articles and publish them to WeChat GZH.",other-tools-and-integrations,https://github.com/caol64/wenyan-mcp,https://github.com/caol64/wenyan-mcp,Apache-2.0,2025-06-02 23:54:09,2026-04-29 07:27:30,2026-04-29 07:25:06,65.0,15.0,133.0,4.0,6.0,5.0,42.0,1227.0,2026-04-29 07:27:30,2.0.3,,,12.0,6.0,17,True,2.0,,,,,,,
119,samuelgursky/davinci-resolve-mcp,samuelgursky/davinci-resolve-mcp,"MCP server integration for DaVinci Resolve providing powerful tools for video editing, color grading, media..",art-and-culture,https://github.com/samuelgursky/davinci-resolve-mcp,https://github.com/samuelgursky/davinci-resolve-mcp,MIT,2025-03-18 03:11:04,2026-05-18 00:19:23,2026-05-18 00:19:18,100.0,85.0,127.0,25.0,15.0,5.0,16.0,1084.0,2026-05-18 00:09:21,2.23.1,,,34.0,6.0,17,True,1.0,,,,,,,
120,pipeboard-co/meta-ads-mcp,pipeboard-co/meta-ads-mcp,"Meta Ads automation that just works. Trusted by 10,000+ businesses to analyze performance, test creatives, optimize..",marketing,https://github.com/pipeboard-co/meta-ads-mcp,https://github.com/pipeboard-co/meta-ads-mcp,,2025-04-11 20:53:47,2026-05-19 13:14:57,2026-05-19 12:42:18,513.0,135.0,224.0,14.0,87.0,8.0,22.0,918.0,2026-05-19 13:14:57,1.0.105,,,100.0,8.0,17,True,1.0,,,,,,,
121,rohitg00/kubectl-mcp-server,rohitg00/kubectl-mcp-server,"A Model Context Protocol (MCP) server for Kubernetes that enables AI assistants like Claude, Cursor, and others to..",cloud-platforms,https://github.com/rohitg00/kubectl-mcp-server,https://github.com/rohitg00/kubectl-mcp-server,MIT,2025-03-23 17:49:07,2026-04-08 22:37:48,2026-04-08 22:37:48,133.0,10.0,168.0,13.0,46.0,3.0,30.0,889.0,2026-02-20 16:53:08,1.24.0,74.0,18.0,24.0,7.0,17,True,3.0,,,,,,,
122,symgraph/GhidrAssistMCP,symgraph/GhidrAssistMCP,"A native Model Context Protocol server for Ghidra. Includes GUI configuration and logging, 31 powerful tools and no..",security,https://github.com/symgraph/GhidrAssistMCP,https://github.com/symgraph/GhidrAssistMCP,MIT,2025-07-09 00:59:13,2026-05-11 00:14:33,2026-05-11 00:11:08,83.0,20.0,47.0,3.0,22.0,3.0,18.0,615.0,2026-05-11 00:15:28,2.7.0,6450.0,645.0,22.0,9.0,17,True,2.0,,,,,,,
123,line/line-bot-mcp-server,line/line-bot-mcp-server,MCP Server for Integrating LINE Official Account.,communication,https://github.com/line/line-bot-mcp-server,https://github.com/line/line-bot-mcp-server,Apache-2.0,2025-04-04 09:15:05,2026-05-19 06:49:07,2026-05-19 06:47:28,380.0,61.0,106.0,7.0,402.0,7.0,41.0,583.0,2025-11-14 09:27:02,0.4.2,,,7.0,15.0,17,True,2.0,,,,,,,
124,joinly-ai/joinly,joinly-ai/joinly,"MCP server to interact with browser-based meeting platforms (Zoom, Teams, Google Meet). Enables AI agents to send bots..",communication,https://github.com/joinly-ai/joinly,https://github.com/joinly-ai/joinly,MIT,2025-05-29 01:21:02,2026-03-19 15:13:10,2026-03-19 13:43:05,820.0,51.0,82.0,7.0,157.0,7.0,9.0,517.0,2025-12-01 18:06:56,0.5.3,,,14.0,5.0,17,True,2.0,,,,,,,
125,massive-com/mcp_massive,massive-com/mcp_massive,An MCP server for Massive.com Financial Market Data.,finance-and-fintech,https://github.com/massive-com/mcp_massive,https://github.com/massive-com/mcp_massive,MIT,2025-03-19 22:05:09,2026-05-05 20:28:21,2026-05-05 20:26:20,104.0,44.0,91.0,11.0,51.0,1.0,39.0,333.0,2026-05-05 20:28:21,0.10.0,107.0,8.0,23.0,10.0,17,True,2.0,,,,,,,
126,ivnvxd/mcp-server-odoo,ivnvxd/mcp-server-odoo,"Connect AI assistants to Odoo ERP systems for business data access, record management, and workflow automation.",other-tools-and-integrations,https://github.com/ivnvxd/mcp-server-odoo,https://github.com/ivnvxd/mcp-server-odoo,MPL-2.0,2025-03-22 20:45:03,2026-05-02 13:31:25,2026-05-02 13:30:53,177.0,95.0,131.0,13.0,39.0,8.0,18.0,288.0,2026-05-02 13:32:33,0.6.0,,,18.0,4.0,17,True,2.0,,,,,,,
127,flytohub/flyto-core,flytohub/flyto-core,"Deterministic execution engine for AI agents with 412 modules across 78 categories (browser, file, Docker, data,..",developer-tools,https://github.com/flytohub/flyto-core,https://github.com/flytohub/flyto-core,Apache-2.0,2025-12-04 08:50:27,2026-05-13 17:22:19,2026-05-13 17:21:41,372.0,180.0,48.0,28.0,11.0,1.0,2.0,270.0,2026-02-15 17:59:42,2.5.0,,,4.0,7.0,17,True,2.0,5.0,5.0,-1.0,,,,
128,storybookjs/mcp,storybookjs/mcp,Help agents automatically write and test stories for your UI components.,developer-tools,https://github.com/storybookjs/mcp,https://github.com/storybookjs/mcp,MIT,2025-08-21 19:11:25,2026-05-19 15:59:26,2026-05-19 13:54:55,736.0,212.0,33.0,5.0,188.0,16.0,19.0,237.0,2026-04-14 11:39:53,@storybook/mcp@0.7.0,,,53.0,15.0,17,True,2.0,,,,,,,
129,radareorg/radare2-mcp,radareorg/radare2-mcp,MCP server for Radare2 disassembler. Provides AI with capability to disassemble and look into binaries for reverse..,security,https://github.com/radareorg/radare2-mcp,https://github.com/radareorg/radare2-mcp,MIT,2025-03-22 22:34:03,2026-05-11 11:38:54,2026-05-11 11:38:43,268.0,82.0,29.0,2.0,45.0,5.0,15.0,233.0,2026-04-28 15:18:55,1.8.0,544.0,54.0,13.0,10.0,17,True,2.0,,,,,,,
130,g0t4/mcp-server-commands,g0t4/mcp-server-commands,Run any command with run_command and run_script tools.,command-line,https://github.com/g0t4/mcp-server-commands,https://github.com/g0t4/mcp-server-commands,MIT,2024-11-29 02:39:02,2026-05-12 01:22:52,2026-04-09 08:33:53,470.0,127.0,33.0,3.0,7.0,3.0,5.0,224.0,2026-04-09 08:38:13,0.8.2,,,5.0,3.0,17,True,2.0,,,,,,,
131,comet-ml/opik-mcp,comet-ml/opik-mcp,"Use natural language to explore LLM observability, traces, and monitoring data captured by Opik.",developer-tools,https://github.com/comet-ml/opik-mcp,https://github.com/comet-ml/opik-mcp,Apache-2.0,2025-03-11 16:31:03,2026-05-19 16:24:45,2026-03-07 03:41:27,160.0,31.0,31.0,5.0,66.0,3.0,29.0,204.0,2026-03-07 03:43:46,2.0.1,,,1.0,9.0,17,True,2.0,3.0,3.0,-1.0,,,,
132,reza-gholizade/k8s-mcp-server,reza-gholizade/k8s-mcp-server,A Kubernetes Model Context Protocol (MCP) server that provides tools for interacting with Kubernetes clusters through..,cloud-platforms,https://github.com/reza-gholizade/k8s-mcp-server,https://github.com/reza-gholizade/k8s-mcp-server,MIT,2025-04-13 21:22:39,2026-05-18 09:50:22,2026-05-18 09:50:15,239.0,44.0,35.0,5.0,106.0,,9.0,157.0,2025-11-19 11:42:43,1.0.24,388.0,35.0,15.0,11.0,17,True,3.0,,,,,,,
133,lfnovo/content-core,lfnovo/content-core,"Extract content from URLs, documents, videos, and audio files using intelligent auto-engine selection. Supports web..",search-data-extraction,https://github.com/lfnovo/content-core,https://github.com/lfnovo/content-core,MIT,2025-04-14 19:07:37,2026-05-12 22:56:40,2026-04-14 13:45:11,170.0,26.0,27.0,2.0,25.0,2.0,11.0,149.0,2026-04-13 14:22:32,2.0.3,,,12.0,5.0,17,True,2.0,38.0,38.0,,,,,
134,FradSer/mcp-server-apple-events,FradSer/mcp-server-apple-events,An MCP server for interacting with Apple Reminders on macOS.,browser-automation,https://github.com/FradSer/mcp-server-apple-events,https://github.com/FradSer/mcp-server-apple-events,MIT,2025-02-14 18:03:02,2026-05-15 07:40:38,2026-05-15 07:40:34,498.0,65.0,34.0,4.0,55.0,4.0,35.0,116.0,2026-03-10 07:18:02,1.4.0,,,16.0,15.0,17,True,2.0,,,,,,,
135,tuannvm/mcp-trino,tuannvm/mcp-trino,A Go implementation of a Model Context Protocol (MCP) server for Trino.,databases,https://github.com/tuannvm/mcp-trino,https://github.com/tuannvm/mcp-trino,MIT,2025-04-09 14:10:52,2026-05-18 06:44:46,2026-04-16 17:44:01,263.0,8.0,45.0,3.0,172.0,12.0,18.0,105.0,2026-04-01 22:25:01,4.3.1,16215.0,1247.0,44.0,17.0,17,True,2.0,,,,,,,
136,nguyenvanduocit/jira-mcp,nguyenvanduocit/jira-mcp,A Go-based MCP connector for Jira that enables AI assistants like Claude to interact with Atlassian Jira. This tool..,support-and-service-management,https://github.com/nguyenvanduocit/jira-mcp,https://github.com/nguyenvanduocit/jira-mcp,MIT,2025-03-25 13:35:58,2026-04-18 10:47:29,2026-04-18 10:47:26,165.0,47.0,23.0,1.0,52.0,,11.0,89.0,2026-04-18 10:34:26,1.4.0,338.0,169.0,10.0,8.0,17,True,3.0,,,,,,,
137,idosal/git-mcp,idosal/git-mcp,gitmcp.io is a generic remote MCP server to connect to ANY GitHub repository or project for documentation.,developer-tools,https://github.com/idosal/git-mcp,https://github.com/idosal/git-mcp,Apache-2.0,2025-03-29 00:44:19,2026-05-08 14:21:24,2026-05-08 14:21:22,280.0,8.0,708.0,47.0,154.0,52.0,24.0,8084.0,,,,,,16.0,16,True,2.0,,,,,,,
138,executeautomation/mcp-playwright,executeautomation/mcp-playwright,An MCP server using Playwright for browser automation and webscrapping.,browser-automation,https://github.com/executeautomation/mcp-playwright,https://github.com/executeautomation/mcp-playwright,MIT,2024-12-03 18:43:20,2025-12-13 04:28:38,2025-12-13 04:28:37,312.0,,508.0,33.0,110.0,21.0,83.0,5524.0,,,,,,34.0,16,True,3.0,,,,,,,
139,Jpisnice/shadcn-ui-mcp-server,Jpisnice/shadcn-ui-mcp-server,"MCP server that gives AI assistants seamless access to shadcn/ui v4 components, blocks, demos, and metadata.",developer-tools,https://github.com/Jpisnice/shadcn-ui-mcp-server,https://github.com/Jpisnice/shadcn-ui-mcp-server,MIT,2025-04-07 13:10:12,2026-05-16 13:09:07,2026-05-16 13:09:07,132.0,8.0,287.0,19.0,27.0,1.0,20.0,2769.0,2026-01-30 14:47:32,2.0.0,,,3.0,19.0,16,True,2.0,,,,,,,
140,joshuayoes/ios-simulator-mcp,joshuayoes/ios-simulator-mcp,A Model Context Protocol (MCP) server for interacting with iOS simulators. This server allows you to interact with iOS..,developer-tools,https://github.com/joshuayoes/ios-simulator-mcp,https://github.com/joshuayoes/ios-simulator-mcp,MIT,2025-03-20 02:39:27,2026-04-21 21:27:16,2026-04-21 21:25:47,115.0,5.0,87.0,8.0,41.0,15.0,15.0,1988.0,2026-04-21 21:27:16,1.6.0,,,15.0,15.0,16,True,2.0,4.0,4.0,,,,,
141,isaacphi/mcp-language-server,isaacphi/mcp-language-server,MCP Language Server helps MCP enabled clients navigate codebases more easily by giving them access to semantic tools..,developer-tools,https://github.com/isaacphi/mcp-language-server,https://github.com/isaacphi/mcp-language-server,BSD-3-Clause,2024-12-30 20:43:23,2026-03-01 23:27:09,2025-06-03 18:29:15,104.0,,115.0,11.0,76.0,30.0,21.0,1531.0,2025-05-16 17:41:09,0.1.1,,,2.0,4.0,16,True,2.0,3.0,3.0,,,,,
142,jau123/MeiGen-AI-Design-MCP,jau123/MeiGen-AI-Design-MCP,"AI image generation & editing MCP server with 1,500+ curated prompt library, smart prompt enhancement, and multi-..",art-and-culture,https://github.com/jau123/MeiGen-AI-Design-MCP,https://github.com/jau123/MeiGen-AI-Design-MCP,MIT,2026-02-07 12:39:26,2026-05-19 04:57:18,2026-05-19 04:57:15,115.0,68.0,148.0,10.0,1.0,,4.0,1159.0,2026-05-19 04:54:13,1.3.2,,,14.0,,16,True,2.0,,,,,,,
143,xing5/mcp-google-sheets,xing5/mcp-google-sheets,"A Model Context Protocol server for interacting with Google Sheets. This server provides tools to create, read,..",databases,https://github.com/xing5/mcp-google-sheets,https://github.com/xing5/mcp-google-sheets,MIT,2025-03-22 01:01:45,2026-05-14 21:12:23,2026-05-14 21:12:16,35.0,7.0,201.0,7.0,36.0,17.0,25.0,867.0,2026-05-14 21:09:11,0.6.3,,,12.0,17.0,16,True,2.0,,,,,,,
144,base/base-mcp,base/base-mcp,"Base Network integration for onchain tools, allowing interaction with Base Network and Coinbase API for wallet..",finance-and-fintech,https://github.com/base/base-mcp-legacy,https://github.com/base/base-mcp-legacy,MIT,2025-03-06 21:57:34,2026-05-13 20:07:50,2026-05-13 20:07:49,172.0,17.0,124.0,8.0,,,,347.0,2026-05-12 18:04:32,1.0.13-final,,,3.0,8.0,16,True,2.0,,,,base/base-mcp-legacy,,,
145,cr7258/elasticsearch-mcp-server,cr7258/elasticsearch-mcp-server,MCP Server implementation that provides Elasticsearch interaction.,databases,https://github.com/cr7258/elasticsearch-mcp-server,https://github.com/cr7258/elasticsearch-mcp-server,Apache-2.0,2025-01-09 04:20:03,2026-05-06 14:58:38,2026-05-06 14:58:35,173.0,25.0,59.0,3.0,42.0,8.0,12.0,277.0,2026-05-06 14:58:42,2.1.1,,,23.0,12.0,16,True,2.0,,,,,,,
146,lharries/whatsapp-mcp,lharries/whatsapp-mcp,"An MCP server for searching your personal WhatsApp messages, contacts and sending messages to individuals or groups.",communication,https://github.com/lharries/whatsapp-mcp,https://github.com/lharries/whatsapp-mcp,MIT,2025-03-29 12:49:33,2025-07-13 17:22:00,2025-07-13 17:22:00,27.0,,1024.0,48.0,148.0,78.0,22.0,5663.0,2025-04-06 16:56:27,0.0.1,,,1.0,5.0,15,True,3.0,,,,,,,
147,Coding-Solo/godot-mcp,Coding-Solo/godot-mcp,"A MCP server for interacting with the Godot game engine, providing tools for editing, running, debugging, and managing..",gaming,https://github.com/Coding-Solo/godot-mcp,https://github.com/Coding-Solo/godot-mcp,MIT,2025-02-26 21:58:45,2026-04-16 23:37:00,2026-04-16 23:36:55,60.0,6.0,371.0,31.0,55.0,27.0,27.0,3738.0,,,,,,8.0,15,True,3.0,,,,,,,
148,crystaldba/postgres-mcp,crystaldba/postgres-mcp,"All-in-one MCP server for Postgres development and operations, with tools for performance analysis, tuning, and health..",databases,https://github.com/crystaldba/postgres-mcp,https://github.com/crystaldba/postgres-mcp,MIT,2025-03-24 18:28:53,2026-01-22 16:24:36,2026-01-22 14:50:36,79.0,,294.0,10.0,119.0,32.0,13.0,2762.0,2025-05-16 14:45:33,0.3.0,238.0,18.0,4.0,10.0,15,True,2.0,9.0,9.0,,,,,
149,cjo4m06/mcp-shrimp-task-manager,cjo4m06/mcp-shrimp-task-manager,"A programming-focused task management system that boosts coding agents like Cursor AI with advanced task memory, self-..",developer-tools,https://github.com/cjo4m06/mcp-shrimp-task-manager,https://github.com/cjo4m06/mcp-shrimp-task-manager,MIT,2025-04-12 08:59:07,2025-08-21 08:55:59,2025-08-21 08:55:59,234.0,,234.0,18.0,38.0,34.0,46.0,2104.0,,,,,,9.0,15,True,2.0,3.0,3.0,,,,,
150,mark3labs/mcp-filesystem-server,mark3labs/mcp-filesystem-server,Golang implementation for local file system access.,file-systems,https://github.com/mark3labs/mcp-filesystem-server,https://github.com/mark3labs/mcp-filesystem-server,MIT,2024-11-28 12:15:08,2025-11-24 15:46:55,2025-11-23 17:20:25,55.0,,103.0,7.0,37.0,18.0,14.0,642.0,2025-06-22 20:23:14,0.11.1,1772.0,126.0,14.0,8.0,15,True,3.0,38.0,38.0,,,,,
151,hustcc/mcp-mermaid,hustcc/mcp-mermaid,Generate mermaid diagram and chart with AI MCP dynamically.,customer-data-platforms,https://github.com/hustcc/mcp-mermaid,https://github.com/hustcc/mcp-mermaid,MIT,2025-05-20 11:43:48,2026-05-15 12:16:57,2026-05-15 12:16:57,28.0,6.0,51.0,3.0,28.0,3.0,14.0,558.0,2026-02-12 02:46:26,0.4.1,,,6.0,12.0,15,True,2.0,4.0,4.0,,,,,
152,centralmind/gateway,centralmind/gateway,"MCP and MCP SSE Server that automatically generate API based on database schema and data. Supports PostgreSQL,..",databases,https://github.com/centralmind/gateway,https://github.com/centralmind/gateway,Apache-2.0,2025-02-10 19:34:14,2025-07-18 16:15:36,2025-07-18 16:15:36,477.0,,66.0,9.0,40.0,14.0,36.0,530.0,2025-07-12 08:14:25,0.2.19,1457.0,97.0,38.0,11.0,15,True,2.0,,,,,,,
153,openbnb-org/mcp-server-airbnb,openbnb-org/mcp-server-airbnb,Provides tools to search Airbnb and get listing details.,travel-and-transportation,https://github.com/openbnb-org/mcp-server-airbnb,https://github.com/openbnb-org/mcp-server-airbnb,MIT,2025-03-10 00:20:50,2026-04-14 00:54:59,2026-04-14 00:54:56,22.0,6.0,106.0,3.0,12.0,4.0,16.0,456.0,2026-04-10 19:07:01,0.2.0,1085.0,108.0,3.0,4.0,15,True,1.0,,,,,,,
154,strowk/mcp-k8s-go,strowk/mcp-k8s-go,Kubernetes cluster operations through MCP.,cloud-platforms,https://github.com/strowk/mcp-k8s-go,https://github.com/strowk/mcp-k8s-go,MIT,2024-12-01 07:00:54,2025-12-22 20:12:06,2025-12-15 20:24:47,361.0,,56.0,4.0,58.0,8.0,10.0,382.0,2025-11-15 07:19:51,0.6.1,1652.0,97.0,33.0,12.0,15,True,3.0,3.0,3.0,,,,,
155,FreePeak/db-mcp-server,FreePeak/db-mcp-server,"A high-performance multi-database MCP server built with Golang, supporting MySQL & PostgreSQL (NoSQL coming soon)...",databases,https://github.com/FreePeak/db-mcp-server,https://github.com/FreePeak/db-mcp-server,MIT,2025-03-17 20:40:28,2026-04-19 05:44:30,2026-04-19 05:44:29,173.0,14.0,63.0,2.0,38.0,12.0,14.0,379.0,2026-04-11 04:25:44,1.9.0,,,17.0,7.0,15,True,2.0,,,,,,,
156,InditexTech/mcp-teams-server,InditexTech/mcp-teams-server,"MCP server that integrates Microsoft Teams messaging (read, post, mention, list members and threads).",communication,https://github.com/InditexTech/mcp-teams-server,https://github.com/InditexTech/mcp-teams-server,Apache-2.0,2025-03-18 13:03:30,2026-05-19 00:27:47,2026-05-13 15:20:09,149.0,20.0,34.0,4.0,95.0,1.0,2.0,373.0,2026-05-13 15:21:16,1.0.9,,,10.0,3.0,15,True,3.0,,,,,,,
157,mavdol/capsule,mavdol/capsule,Run untrusted Python/JavaScript code in WebAssembly sandboxes.,code-execution,https://github.com/capsulerun/capsule,https://github.com/capsulerun/capsule,Apache-2.0,2025-12-01 13:01:33,2026-05-15 12:40:37,2026-05-15 12:40:36,688.0,230.0,19.0,4.0,174.0,,2.0,284.0,2026-04-27 12:20:49,0.8.10,,,26.0,,15,True,3.0,1.0,1.0,,capsulerun/capsule,,,
158,natsukium/mcp-servers-nix,natsukium/mcp-servers-nix,A Nix-based configuration framework for Model Context Protocol (MCP) servers with ready-to-use packages.,developer-tools,https://github.com/natsukium/mcp-servers-nix,https://github.com/natsukium/mcp-servers-nix,Apache-2.0,2025-04-06 17:58:14,2026-05-19 14:40:16,2026-05-19 14:40:14,860.0,258.0,33.0,3.0,452.0,7.0,15.0,253.0,,,,,,12.0,15,True,2.0,,,,,,,
159,gannonh/firebase-mcp,gannonh/firebase-mcp,"Firebase services including Auth, Firestore and Storage.",databases,https://github.com/gannonh/firebase-mcp,https://github.com/gannonh/firebase-mcp,MIT,2025-03-08 21:00:09,2025-10-27 11:00:06,2025-05-26 13:02:19,201.0,,41.0,3.0,136.0,5.0,30.0,244.0,2025-05-10 16:20:39,1.4.9,,,8.0,4.0,15,True,2.0,4.0,4.0,,,,,
160,gbrigandi/mcp-server-wazuh,gbrigandi/mcp-server-wazuh,"A Rust-based MCP server bridging Wazuh SIEM with AI assistants, providing real-time security alerts and event data for..",security,https://github.com/gbrigandi/mcp-server-wazuh,https://github.com/gbrigandi/mcp-server-wazuh,MIT,2025-05-07 18:14:55,2025-12-12 03:06:04,2025-12-08 16:15:24,45.0,,51.0,13.0,4.0,4.0,16.0,207.0,2025-12-12 03:09:36,0.3.0,1917.0,159.0,9.0,,15,True,3.0,,,,,,,
161,tacticlaunch/mcp-linear,tacticlaunch/mcp-linear,Integrates with Linear project management system.,other-tools-and-integrations,https://github.com/tacticlaunch/mcp-linear,https://github.com/tacticlaunch/mcp-linear,MIT,2025-03-23 15:27:19,2026-05-03 22:15:14,2026-05-03 22:15:13,121.0,74.0,31.0,3.0,22.0,,9.0,133.0,2026-05-03 22:15:15,1.1.2,,,16.0,11.0,15,True,2.0,,,,,,,
162,cswkim/discogs-mcp-server,cswkim/discogs-mcp-server,MCP server to interact with the Discogs API.,art-and-culture,https://github.com/cswkim/discogs-mcp-server,https://github.com/cswkim/discogs-mcp-server,MIT,2025-04-04 18:17:51,2026-05-19 14:44:34,2026-05-19 14:44:31,548.0,80.0,14.0,6.0,170.0,1.0,5.0,99.0,2026-03-09 17:36:58,0.5.6,,,14.0,2.0,15,True,2.0,3.0,3.0,,,,,
163,BrowserMCP/mcp,BrowserMCP/mcp,Automate your local Chrome browser.,browser-automation,https://github.com/BrowserMCP/mcp,https://github.com/BrowserMCP/mcp,Apache-2.0,2025-03-28 02:01:22,2025-04-24 21:49:44,2025-04-24 21:49:35,6.0,,495.0,18.0,17.0,121.0,38.0,6528.0,,,,,,,14,False,3.0,34.0,34.0,,,,,
164,MarkusPfundstein/mcp-obsidian,MarkusPfundstein/mcp-obsidian,Interacting with Obsidian via REST API.,other-tools-and-integrations,https://github.com/MarkusPfundstein/mcp-obsidian,https://github.com/MarkusPfundstein/mcp-obsidian,MIT,2024-11-29 11:07:12,2026-05-15 10:25:32,2026-05-15 10:25:28,71.0,16.0,426.0,18.0,69.0,59.0,12.0,3725.0,,,,,,18.0,14,True,2.0,1.0,1.0,2.0,,,,
165,metorial/metorial,metorial/metorial,"Connect AI agents to 600+ integrations with a single interface - OAuth, scaling, and monitoring included.",other-tools-and-integrations,https://github.com/metorial/metorial,https://github.com/metorial/metorial,Apache-2.0,2025-04-14 08:41:58,2026-05-19 23:26:09,2026-04-30 21:17:36,2660.0,1.0,348.0,18.0,95.0,,10.0,3282.0,,,,,,7.0,14,True,2.0,,,,,,,
166,ezyang/codemcp,ezyang/codemcp,"Coding agent with basic read, write and command line tools.",coding-agents,https://github.com/ezyang/codemcp,https://github.com/ezyang/codemcp,Apache-2.0,2025-03-09 03:58:34,2025-12-25 02:10:23,2025-12-25 02:10:23,1089.0,,139.0,13.0,249.0,39.0,26.0,1615.0,2025-04-20 07:50:01,0.6.0,,,1.0,9.0,14,True,3.0,,,,,,,
167,bitbonsai/mcpvault,bitbonsai/mcpvault,Universal AI bridge for Obsidian vaults using MCP. Provides safe read/write access to notes with 11 comprehensive..,knowledge-and-memory,https://github.com/bitbonsai/mcpvault,https://github.com/bitbonsai/mcpvault,,2025-09-21 20:50:15,2026-05-18 21:40:45,2026-04-16 06:13:51,208.0,98.0,103.0,11.0,57.0,13.0,46.0,1280.0,,,,,,13.0,14,True,2.0,,,,,,,
168,designcomputer/mysql_mcp_server,designcomputer/mysql_mcp_server,"MySQL database integration with configurable access controls, schema inspection, and comprehensive security guidelines.",databases,https://github.com/designcomputer/mysql_mcp_server,https://github.com/designcomputer/mysql_mcp_server,MIT,2024-12-03 20:53:52,2025-06-05 11:05:28,2025-06-05 11:05:27,69.0,,237.0,7.0,27.0,44.0,15.0,1252.0,2025-04-18 20:29:02,0.2.2,,,6.0,7.0,14,True,3.0,,,,,,,
169,rinadelph/Agent-MCP,rinadelph/Agent-MCP,"A framework for creating multi-agent systems using MCP for coordinated AI collaboration, featuring task management,..",coding-agents,https://github.com/rinadelph/Agent-MCP,https://github.com/rinadelph/Agent-MCP,,2025-05-13 15:40:10,2026-03-28 13:25:52,2025-10-09 17:24:29,300.0,,162.0,13.0,22.0,18.0,17.0,1234.0,2025-09-02 01:45:57,4.20.1,,,2.0,7.0,14,True,3.0,,,,,,,
170,karanb192/reddit-mcp-buddy,karanb192/reddit-mcp-buddy,"Browse Reddit posts, search content, and analyze user activity without API keys. Works out-of-the-box with Claude..",social-media,https://github.com/karanb192/reddit-mcp-buddy,https://github.com/karanb192/reddit-mcp-buddy,MIT,2025-09-14 05:52:29,2026-03-17 05:48:54,2026-03-17 05:48:52,54.0,4.0,81.0,3.0,42.0,4.0,2.0,653.0,2026-02-21 06:18:29,1.1.12,1422.0,177.0,6.0,2.0,14,True,1.0,,,,,,,
171,neondatabase/mcp-server-neon,neondatabase/mcp-server-neon,MCP server for interacting with Neon Management API and databases.,databases,https://github.com/neondatabase/mcp-server-neon,https://github.com/neondatabase/mcp-server-neon,MIT,2024-11-29 19:08:55,2026-05-19 15:20:09,2026-05-14 12:48:00,226.0,40.0,109.0,11.0,229.0,13.0,27.0,598.0,,,,,,19.0,14,True,3.0,,,,,,,
172,Tiberriver256/mcp-server-azure-devops,Tiberriver256/mcp-server-azure-devops,"Azure DevOps integration for repository management, work items, and pipelines.",version-control,https://github.com/Tiberriver256/mcp-server-azure-devops,https://github.com/Tiberriver256/mcp-server-azure-devops,MIT,2025-02-28 00:05:42,2026-02-05 17:34:28,2026-02-05 17:34:12,229.0,,120.0,5.0,159.0,20.0,51.0,367.0,2026-02-05 17:34:28,mcp-server-azure-devops-v0.1.45,,,42.0,14.0,14,True,3.0,,,,,,,
173,chaindead/telegram-mcp,chaindead/telegram-mcp,"Telegram API integration for accessing user data, managing dialogs (chats, channels, groups), retrieving messages, and..",communication,https://github.com/chaindead/telegram-mcp,https://github.com/chaindead/telegram-mcp,MIT,2025-04-01 14:43:04,2026-02-27 21:31:40,2026-02-27 21:26:30,69.0,2.0,45.0,3.0,15.0,4.0,6.0,327.0,2026-02-27 21:36:51,0.2.0,2567.0,197.0,24.0,3.0,14,True,3.0,,,,,,,
174,SaseQ/discord-mcp,SaseQ/discord-mcp,A MCP server for the Discord integration. Enable your AI assistants to seamlessly interact with Discord. Enhance your..,communication,https://github.com/SaseQ/discord-mcp,https://github.com/SaseQ/discord-mcp,MIT,2025-03-14 21:00:40,2026-04-25 13:55:22,2026-04-25 13:54:53,89.0,25.0,70.0,1.0,12.0,5.0,6.0,311.0,2026-03-16 18:03:35,1.0.0,72.0,36.0,1.0,10.0,14,True,3.0,,,,,,,
175,admica/FileScopeMCP,admica/FileScopeMCP,Analyzes your codebase identifying important files based on dependency relationships. Generates diagrams and..,developer-tools,https://github.com/admica/FileScopeMCP,https://github.com/admica/FileScopeMCP,,2025-03-27 19:35:07,2026-05-10 23:41:16,2026-05-10 23:41:03,603.0,510.0,32.0,2.0,5.0,,9.0,292.0,2025-06-11 16:58:24,2.8.0,,,4.0,8.0,14,True,2.0,,,,,,,
176,Snowflake-Labs/mcp,Snowflake-Labs/mcp,"Open-source MCP server for Snowflake from official Snowflake-Labs supports prompting Cortex Agents, querying..",databases,https://github.com/Snowflake-Labs/mcp,https://github.com/Snowflake-Labs/mcp,Apache-2.0,2025-05-22 20:58:02,2026-05-15 16:30:51,2026-05-15 12:58:16,145.0,7.0,93.0,9.0,124.0,19.0,47.0,286.0,2026-05-15 16:30:51,.1.4.2,,,9.0,16.0,14,True,3.0,,,,,,,
177,kiliczsh/mcp-mongo-server,kiliczsh/mcp-mongo-server,A Model Context Protocol Server for MongoDB.,databases,https://github.com/kiliczsh/mcp-mongo-server,https://github.com/kiliczsh/mcp-mongo-server,MIT,2024-12-04 19:30:40,2026-02-06 17:08:17,2026-02-06 15:40:43,50.0,,53.0,4.0,13.0,2.0,16.0,278.0,2026-02-06 15:41:58,2.0.2,,,13.0,7.0,14,True,3.0,3.0,3.0,,,,,
178,hechtcarmel/jetbrains-index-mcp-plugin,hechtcarmel/jetbrains-index-mcp-plugin,"A JetBrains IDE plugin that exposes an MCP server, enabling AI coding assistants to leverage the IDEs indexing and..",developer-tools,https://github.com/hechtcarmel/jetbrains-index-mcp-plugin,https://github.com/hechtcarmel/jetbrains-index-mcp-plugin,MIT,2025-11-25 07:43:21,2026-05-19 05:19:48,2026-05-19 05:19:48,209.0,63.0,48.0,2.0,125.0,2.0,56.0,212.0,,,,,,16.0,14,True,2.0,,,,,,,
