,name,github_id,description,category,github_url,homepage,license,created_at,updated_at,last_commit_pushed_at,commit_count,recent_commit_count,fork_count,watchers_count,pr_count,open_issue_count,closed_issue_count,star_count,latest_stable_release_published_at,latest_stable_release_number,github_release_downloads,monthly_downloads,release_count,contributor_count,projectrank,show,projectrank_placing,dependent_project_count,github_dependent_project_count,trending,updated_github_id,pypi_id,pypi_url,pypi_monthly_downloads
240,sxhxliang/mcp-access-point,sxhxliang/mcp-access-point,Turn a web service into an MCP server in one click without making any code changes.,aggregators,https://github.com/sxhxliang/mcp-access-point,https://github.com/sxhxliang/mcp-access-point,MIT,2025-04-06 15:35:00,2026-03-11 03:03:01,2026-03-11 03:02:49,92.0,1.0,29.0,4.0,7.0,2.0,14.0,172.0,2025-09-30 08:39:37,0.3.0,,,10.0,5.0,12,True,3.0,,,,,,,
241,entanglr/zettelkasten-mcp,entanglr/zettelkasten-mcp,"A Model Context Protocol (MCP) server that implements the Zettelkasten knowledge management methodology, allowing you..",knowledge-and-memory,https://github.com/entanglr/zettelkasten-mcp,https://github.com/entanglr/zettelkasten-mcp,MIT,2025-04-01 21:33:20,2025-04-25 08:11:20,2025-04-25 07:57:32,29.0,,27.0,6.0,24.0,4.0,3.0,152.0,2025-04-25 07:59:45,1.2.1,,,4.0,,12,False,3.0,,,,,,,
242,aashari/mcp-server-atlassian-bitbucket,aashari/mcp-server-atlassian-bitbucket,"Atlassian Bitbucket Cloud integration. Enables AI systems to interact with repositories, pull requests, workspaces,..",developer-tools,https://github.com/aashari/mcp-server-atlassian-bitbucket,https://github.com/aashari/mcp-server-atlassian-bitbucket,,2025-03-24 12:18:56,2026-03-06 07:29:48,2026-03-06 07:29:47,595.0,1.0,54.0,4.0,196.0,6.0,23.0,146.0,2026-02-17 08:38:51,3.1.0,,,100.0,8.0,12,True,3.0,1.0,1.0,,,,,
243,ergut/mcp-bigquery-server,ergut/mcp-bigquery-server,Server implementation for Google BigQuery integration that enables direct BigQuery database access and querying..,databases,https://github.com/ergut/mcp-bigquery-server,https://github.com/ergut/mcp-bigquery-server,MIT,2024-12-03 19:57:59,2026-04-20 16:05:58,2026-04-20 16:05:49,27.0,3.0,32.0,3.0,8.0,1.0,6.0,139.0,2025-04-03 12:36:59,1.0.3,,,1.0,4.0,12,True,3.0,6.0,6.0,,,,,
244,roychri/mcp-server-asana,roychri/mcp-server-asana,This Model Context Protocol server implementation of Asana allows you to talk to Asana API from MCP Client such as..,other-tools-and-integrations,https://github.com/roychri/mcp-server-asana,https://github.com/roychri/mcp-server-asana,MIT,2024-12-04 23:23:56,2026-05-10 14:47:21,2026-04-23 18:17:06,99.0,12.0,61.0,3.0,26.0,5.0,21.0,139.0,,,,,,12.0,12,True,3.0,,,,,,,
245,wso2/fhir-mcp-server,wso2/fhir-mcp-server,Model Context Protocol server for Fast Healthcare Interoperability Resources (FHIR) APIs. Provides seamless..,bio,https://github.com/wso2/fhir-mcp-server,https://github.com/wso2/fhir-mcp-server,Apache-2.0,2025-06-18 12:57:58,2026-05-12 05:25:04,2026-05-04 06:24:09,96.0,13.0,41.0,8.0,35.0,,6.0,119.0,2025-10-30 09:51:56,0.10.0,18.0,1.0,2.0,8.0,12,True,3.0,,,,,,,
246,13bm/GhidraMCP,13bm/GhidraMCP,"MCP server for integrating Ghidra with AI assistants. This plugin enables binary analysis, providing tools for..",security,https://github.com/13bm/GhidraMCP,https://github.com/13bm/GhidraMCP,Apache-2.0,2025-03-24 12:54:19,2026-05-14 10:03:51,2026-03-27 15:25:56,24.0,9.0,19.0,4.0,8.0,1.0,4.0,112.0,2026-03-23 14:40:27,0.2.2+ghidra12.0.4,975.0,69.0,6.0,2.0,12,True,3.0,,,,,,,
247,CircleCI-Public/mcp-server-circleci,CircleCI-Public/mcp-server-circleci,Enable AI Agents to fix build failures from CircleCI.,developer-tools,https://github.com/CircleCI-Public/mcp-server-circleci,https://github.com/CircleCI-Public/mcp-server-circleci,,2025-03-26 18:31:55,2026-05-18 05:27:56,2026-04-27 13:23:00,308.0,23.0,57.0,11.0,137.0,17.0,8.0,84.0,,,,,,26.0,12,True,3.0,4.0,4.0,,,,,
248,yuna0x0/anilist-mcp,yuna0x0/anilist-mcp,A MCP server integrating AniList API for anime and manga information.,art-and-culture,https://github.com/yuna0x0/anilist-mcp,https://github.com/yuna0x0/anilist-mcp,MIT,2025-03-20 16:00:06,2025-11-28 21:34:00,2025-11-28 21:30:45,63.0,,12.0,1.0,4.0,1.0,5.0,76.0,2025-11-28 21:34:00,1.4.0,7791.0,556.0,30.0,3.0,12,True,3.0,3.0,3.0,,,,,
249,kadykov/mcp-openapi-schema-explorer,kadykov/mcp-openapi-schema-explorer,Token-efficient access to OpenAPI/Swagger specs via MCP Resources.,developer-tools,https://github.com/kadykov/mcp-openapi-schema-explorer,https://github.com/kadykov/mcp-openapi-schema-explorer,MIT,2025-04-08 17:17:39,2026-05-18 03:25:30,2026-05-11 13:30:36,235.0,12.0,12.0,1.0,184.0,1.0,2.0,71.0,2026-01-15 18:45:49,1.3.3,,,9.0,5.0,12,True,3.0,1.0,1.0,,,,,
250,alexander-zuev/supabase-mcp-server,alexander-zuev/supabase-mcp-server,Supabase MCP Server with support for SQL query execution and database exploration tools.,databases,https://github.com/alexander-zuev/supabase-mcp-server,https://github.com/alexander-zuev/supabase-mcp-server,Apache-2.0,2025-02-15 08:54:29,2026-05-08 18:00:45,2025-08-05 07:53:36,122.0,,97.0,13.0,36.0,,,821.0,2025-04-03 10:25:36,0.4,,,19.0,2.0,11,True,3.0,,,,,,,
251,zcaceres/fetch-mcp,zcaceres/fetch-mcp,"An MCP server to flexibly fetch JSON, text, and HTML data.",developer-tools,https://github.com/zcaceres/fetch-mcp,https://github.com/zcaceres/fetch-mcp,MIT,2024-12-18 01:05:17,2026-03-12 17:17:24,2026-03-09 19:47:28,43.0,28.0,113.0,2.0,23.0,1.0,19.0,761.0,,,,,,5.0,11,True,3.0,,,,,,,
252,mem0ai/mem0-mcp,mem0ai/mem0-mcp,"A Model Context Protocol server for Mem0 that helps manage coding preferences and patterns, providing tools for..",knowledge-and-memory,https://github.com/mem0ai/mem0-mcp,https://github.com/mem0ai/mem0-mcp,Apache-2.0,2025-02-18 08:35:49,2026-03-24 23:36:56,2026-03-24 23:36:53,53.0,5.0,137.0,4.0,25.0,,4.0,651.0,,,,,,6.0,11,True,3.0,,,,,,,
253,MarkusPfundstein/mcp-gsuite,MarkusPfundstein/mcp-gsuite,Integration with gmail and Google Calendar.,workplace-and-productivity,https://github.com/MarkusPfundstein/mcp-gsuite,https://github.com/MarkusPfundstein/mcp-gsuite,MIT,2024-11-30 22:32:38,2025-04-14 10:41:50,2025-04-14 10:41:50,67.0,,98.0,5.0,25.0,24.0,10.0,486.0,,,,,,6.0,11,False,3.0,3.0,3.0,,,,,
254,wong2/mcp-cli,wong2/mcp-cli,CLI tool for testing MCP servers.,other-tools-and-integrations,https://github.com/wong2/mcp-cli,https://github.com/wong2/mcp-cli,GPL-3.0,2024-12-05 04:21:46,2026-05-12 09:36:53,2026-05-12 09:36:04,65.0,2.0,35.0,2.0,9.0,6.0,9.0,432.0,,,,,,4.0,11,True,3.0,89.0,89.0,,,,,
255,TencentEdgeOne/edgeone-pages-mcp,TencentEdgeOne/edgeone-pages-mcp,An MCP service for deploying HTML content to EdgeOne Pages and obtaining a publicly accessible URL.,developer-tools,https://github.com/TencentEdgeOne/edgeone-pages-mcp,https://github.com/TencentEdgeOne/edgeone-pages-mcp,MIT,2025-03-25 02:28:36,2026-04-30 07:32:30,2026-04-30 07:32:25,23.0,1.0,56.0,3.0,5.0,7.0,8.0,416.0,,,,,,,11,True,3.0,6.0,6.0,,,,,
256,K-Dense-AI/claude-skills-mcp,K-Dense-AI/claude-skills-mcp,Intelligent search capabilities to let every model and client use Claude Agent Skills like native.,aggregators,https://github.com/K-Dense-AI/claude-skills-mcp,https://github.com/K-Dense-AI/claude-skills-mcp,MIT,2025-10-21 03:53:28,2026-04-08 23:22:43,2026-04-08 23:22:41,51.0,1.0,61.0,5.0,7.0,6.0,1.0,385.0,2025-10-24 01:20:29,1.0.6,,,9.0,3.0,11,True,3.0,,,,,,,
257,mcpdotdirect/evm-mcp-server,mcpdotdirect/evm-mcp-server,"Comprehensive blockchain services for 30+ EVM networks, supporting native tokens, ERC20, NFTs, smart contracts,..",finance-and-fintech,https://github.com/mcpdotdirect/evm-mcp-server,https://github.com/mcpdotdirect/evm-mcp-server,MIT,2025-03-08 23:00:04,2025-11-26 17:09:23,2025-11-26 17:09:21,57.0,,86.0,1.0,21.0,3.0,8.0,376.0,2025-11-26 17:09:23,2.0.4,,,9.0,9.0,11,True,3.0,,,,,,,
258,ttommyth/interactive-mcp,ttommyth/interactive-mcp,Enables interactive LLM workflows by adding local user prompts and chat capabilities directly into the MCP loop.,other-tools-and-integrations,https://github.com/ttommyth/interactive-mcp,https://github.com/ttommyth/interactive-mcp,MIT,2025-04-25 13:38:04,2025-11-20 17:25:27,2025-09-09 13:37:29,47.0,,30.0,1.0,5.0,8.0,9.0,345.0,2025-06-16 14:29:24,1.10.1,,,16.0,5.0,11,True,3.0,,,,,,,
259,CheMiguel23/MemoryMesh,CheMiguel23/MemoryMesh,Enhanced graph-based memory with a focus on AI role-play and story generation.,knowledge-and-memory,https://github.com/CheMiguel23/MemoryMesh,https://github.com/CheMiguel23/MemoryMesh,MIT,2024-12-06 00:50:19,2026-03-01 22:27:33,2026-01-17 17:55:34,106.0,,49.0,4.0,46.0,1.0,8.0,342.0,,,,,,4.0,11,True,3.0,,,,,,,
260,XeroAPI/xero-mcp-server,XeroAPI/xero-mcp-server,"An MCP server that integrates with Xeros API, allowing for standardized access to Xeros accounting and business..",finance-and-fintech,https://github.com/XeroAPI/xero-mcp-server,https://github.com/XeroAPI/xero-mcp-server,MIT,2025-03-17 02:29:58,2026-05-04 23:14:09,2026-05-04 23:14:06,93.0,4.0,129.0,17.0,113.0,38.0,8.0,286.0,,,,,,18.0,11,True,3.0,,,,,,,
261,jinzcdev/markmap-mcp-server,jinzcdev/markmap-mcp-server,An MCP server built on markmap that converts Markdown to interactive mind maps. Supports multi-format exports..,knowledge-and-memory,https://github.com/jinzcdev/markmap-mcp-server,https://github.com/jinzcdev/markmap-mcp-server,MIT,2025-04-28 12:53:55,2026-03-18 07:55:48,2026-03-18 07:55:42,24.0,1.0,27.0,2.0,4.0,1.0,,201.0,2025-05-06 07:57:14,0.1.1,,,2.0,2.0,11,True,3.0,3.0,3.0,,,,,
262,lostintangent/gistpad-mcp,lostintangent/gistpad-mcp,"Use GitHub Gists to manage and access your personal knowledge, daily notes, and reusable prompts. This acts as a..",knowledge-and-memory,https://github.com/lostintangent/gistpad-mcp,https://github.com/lostintangent/gistpad-mcp,MIT,2025-03-12 18:02:16,2026-01-16 17:58:32,2026-01-16 17:58:28,61.0,,30.0,4.0,10.0,1.0,20.0,192.0,,,,,,3.0,11,True,3.0,3.0,3.0,,,,,
263,isaacwasserman/mcp-snowflake-server,isaacwasserman/mcp-snowflake-server,Snowflake integration implementing read and (optional) write operations as well as insight tracking.,databases,https://github.com/isaacwasserman/mcp-snowflake-server,https://github.com/isaacwasserman/mcp-snowflake-server,GPL-3.0,2024-12-13 20:30:59,2025-10-07 15:05:17,2025-10-07 15:05:17,86.0,,74.0,4.0,29.0,11.0,10.0,183.0,2025-04-10 14:31:01,0.4.0,,,20.0,10.0,11,True,3.0,,,,,,,
264,alexei-led/aws-mcp-server,alexei-led/aws-mcp-server,"A lightweight but powerful server that enables AI assistants to execute AWS CLI commands, use Unix pipes, and apply..",cloud-platforms,https://github.com/alexei-led/aws-mcp-server,https://github.com/alexei-led/aws-mcp-server,MIT,2025-03-19 13:42:40,2026-02-27 14:42:40,2026-02-27 14:31:23,130.0,2.0,31.0,4.0,26.0,,15.0,182.0,2026-02-27 14:31:51,1.7.0,,,12.0,2.0,11,True,3.0,,,,,,,
265,MladenSU/cli-mcp-server,MladenSU/cli-mcp-server,Command line interface with secure execution and customizable security policies.,command-line,https://github.com/MladenSU/cli-mcp-server,https://github.com/MladenSU/cli-mcp-server,MIT,2024-12-08 23:01:54,2025-07-04 21:02:36,2025-07-04 21:02:07,30.0,,31.0,5.0,7.0,4.0,3.0,169.0,,,,,,4.0,11,True,3.0,3.0,3.0,,,,,
266,HagaiHen/facebook-mcp-server,HagaiHen/facebook-mcp-server,"Integrates with Facebook Pages to enable direct management of posts, comments, and engagement metrics through the..",social-media,https://github.com/HagaiHen/facebook-mcp-server,https://github.com/HagaiHen/facebook-mcp-server,MIT,2025-05-08 16:03:54,2026-04-23 19:08:42,2026-04-23 19:08:42,25.0,3.0,45.0,3.0,8.0,,,154.0,,,,,,3.0,11,True,3.0,,,,,,,
267,pyroprompts/any-chat-completions-mcp,pyroprompts/any-chat-completions-mcp,"Chat with any other OpenAI SDK Compatible Chat Completions API, like Perplexity, Groq, xAI and more.",other-tools-and-integrations,https://github.com/pyroprompts/any-chat-completions-mcp,https://github.com/pyroprompts/any-chat-completions-mcp,MIT,2024-12-02 03:40:01,2025-05-01 02:39:27,2025-05-01 02:39:22,16.0,,26.0,,7.0,5.0,,151.0,2025-05-01 02:33:53,0.1.1,,,2.0,4.0,11,True,3.0,,,,,,,
268,PostHog/mcp,PostHog/mcp,"An MCP server for interacting with PostHog analytics, feature flags, error tracking and more.",developer-tools,https://github.com/PostHog/mcp,https://github.com/PostHog/mcp,MIT,2025-05-14 18:59:03,2026-01-19 16:47:34,2026-01-19 16:47:34,167.0,,25.0,12.0,116.0,16.0,17.0,142.0,2025-09-12 10:58:28,posthog_agent_toolkit-v0.1.2,,,3.0,14.0,11,True,3.0,,,,,,,
269,takashiishida/arxiv-latex-mcp,takashiishida/arxiv-latex-mcp,Get the LaTeX source of arXiv papers to handle mathematical content and equations.,search-data-extraction,https://github.com/takashiishida/arxiv-latex-mcp,https://github.com/takashiishida/arxiv-latex-mcp,MIT,2025-04-07 13:34:29,2026-05-11 22:09:56,2026-05-11 22:09:51,39.0,33.0,13.0,2.0,13.0,2.0,2.0,132.0,2026-03-18 14:18:59,0.2.2,146.0,13.0,4.0,3.0,11,True,3.0,,,,,,,
270,VeriTeknik/pluggedin-mcp-proxy,VeriTeknik/pluggedin-mcp-proxy,A comprehensive proxy server that combines multiple MCP servers into a single interface with extensive visibility..,aggregators,https://github.com/VeriTeknik/pluggedin-mcp-proxy,https://github.com/VeriTeknik/pluggedin-mcp-proxy,Apache-2.0,2025-04-07 12:26:50,2026-05-10 20:39:02,2026-04-06 00:38:39,308.0,38.0,27.0,1.0,1.0,,,129.0,,,,,,7.0,11,True,3.0,,,,,,,
271,BurtTheCoder/mcp-shodan,BurtTheCoder/mcp-shodan,"MCP server for querying the Shodan API and Shodan CVEDB. This server provides tools for IP lookups, device searches,..",security,https://github.com/BurtTheCoder/mcp-shodan,https://github.com/BurtTheCoder/mcp-shodan,MIT,2024-12-12 18:01:09,2026-03-31 18:08:46,2026-03-31 18:08:45,58.0,24.0,22.0,1.0,7.0,1.0,,128.0,,,,,,5.0,11,True,3.0,3.0,3.0,,,,,
272,mrjoshuak/godoc-mcp,mrjoshuak/godoc-mcp,Token-efficient Go documentation server that provides AI assistants with smart access to package docs and types..,other-tools-and-integrations,https://github.com/mrjoshuak/godoc-mcp,https://github.com/mrjoshuak/godoc-mcp,MIT,2024-12-05 01:24:43,2026-03-06 17:15:24,2026-03-06 17:15:17,22.0,3.0,16.0,1.0,4.0,,6.0,117.0,2026-03-06 17:13:55,1.1.0,,,3.0,,11,True,3.0,,,,,,,
273,jparkerweb/mcp-sqlite,jparkerweb/mcp-sqlite,Model Context Protocol (MCP) server that provides comprehensive SQLite database interaction capabilities.,databases,https://github.com/jparkerweb/mcp-sqlite,https://github.com/jparkerweb/mcp-sqlite,MIT,2025-04-05 03:28:31,2026-04-05 04:51:05,2026-04-04 16:44:21,34.0,11.0,14.0,1.0,4.0,,2.0,105.0,2026-04-04 16:45:33,1.0.9,,,4.0,2.0,11,True,3.0,5.0,5.0,,,,,
274,awkoy/replicate-flux-mcp,awkoy/replicate-flux-mcp,Provides the ability to generate images via Replicates API.,other-tools-and-integrations,https://github.com/awkoy/replicate-flux-mcp,https://github.com/awkoy/replicate-flux-mcp,MIT,2025-03-13 20:04:15,2026-04-18 22:46:22,2026-04-18 22:44:13,30.0,1.0,16.0,2.0,5.0,1.0,,104.0,2026-04-19 11:14:40,0.4.0,,,3.0,4.0,11,True,3.0,3.0,3.0,,,,,
275,thingsboard/thingsboard-mcp,thingsboard/thingsboard-mcp,The ThingsBoard MCP Server provides a natural language interface for LLMs and AI agents to interact with your..,other-tools-and-integrations,https://github.com/thingsboard/thingsboard-mcp,https://github.com/thingsboard/thingsboard-mcp,Apache-2.0,2025-06-30 16:48:34,2026-03-16 13:43:46,2026-02-26 09:21:22,78.0,1.0,20.0,4.0,14.0,2.0,19.0,97.0,2026-02-17 14:01:52,2.1.0,158.0,17.0,3.0,5.0,11,True,3.0,,,,,,,
276,zillow/auto-mobile,zillow/auto-mobile,Tool suite built around an MCP server for Android automation for developer workflow and testing.,developer-tools,https://github.com/zillow/auto-mobile,https://github.com/zillow/auto-mobile,Apache-2.0,2025-06-22 20:29:37,2026-03-10 00:38:11,2026-03-10 00:29:35,235.0,1.0,7.0,1.0,115.0,6.0,3.0,79.0,2025-07-22 03:07:57,0.0.5,393.0,35.0,5.0,11.0,11,True,3.0,,,,,,,
277,optuna/optuna-mcp,optuna/optuna-mcp,Official MCP server enabling seamless orchestration of hyperparameter search and other optimization tasks with Optuna.,data-science-tools,https://github.com/optuna/optuna-mcp,https://github.com/optuna/optuna-mcp,MIT,2025-06-10 07:03:55,2026-05-15 08:51:12,2026-05-15 08:51:11,91.0,5.0,23.0,1.0,41.0,,,76.0,2025-11-10 05:30:38,0.2.0,,,4.0,8.0,11,True,3.0,,,,,,,
278,QuantConnect/mcp-server,QuantConnect/mcp-server,"A Dockerized Python MCP server that bridges your local AI (e.g., Claude Desktop, etc) with the QuantConnect..",finance-and-fintech,https://github.com/QuantConnect/mcp-server,https://github.com/QuantConnect/mcp-server,Apache-2.0,2025-06-24 14:26:13,2026-05-07 16:17:32,2026-05-07 16:17:32,356.0,1.0,26.0,1.0,28.0,12.0,16.0,75.0,2025-08-22 16:47:39,0.0.10,,,10.0,5.0,11,True,3.0,,,,,,,
279,ivo-toby/contentful-mcp,ivo-toby/contentful-mcp,"Update, create, delete content, content-models and assets in your Contentful Space.",other-tools-and-integrations,https://github.com/ivo-toby/contentful-mcp,https://github.com/ivo-toby/contentful-mcp,MIT,2024-12-04 18:27:09,2026-01-17 16:45:28,2026-01-17 16:45:04,271.0,,15.0,2.0,37.0,9.0,10.0,60.0,2026-01-17 16:45:33,1.21.0,,,24.0,6.0,11,True,3.0,,,,,,,
280,jae-jae/fetcher-mcp,jae-jae/fetcher-mcp,"MCP server for fetching web page content using Playwright headless browser, supporting Javascript rendering and..",search-data-extraction,https://github.com/jae-jae/fetcher-mcp,https://github.com/jae-jae/fetcher-mcp,MIT,2025-03-19 10:54:49,2026-01-14 07:07:21,2026-01-14 07:07:00,102.0,,94.0,6.0,14.0,2.0,13.0,1049.0,,,,,,5.0,10,True,3.0,,,,,,,
281,tevonsb/homeassistant-mcp,tevonsb/homeassistant-mcp,"Access Home Assistant data and control devices (lights, switches, thermostats, etc).",other-tools-and-integrations,https://github.com/tevonsb/homeassistant-mcp,https://github.com/tevonsb/homeassistant-mcp,Apache-2.0,2024-12-12 06:30:27,2026-01-25 20:52:22,2026-01-25 20:52:21,60.0,,54.0,11.0,8.0,14.0,3.0,573.0,,,,,,3.0,10,True,3.0,,,,,,,
282,kimtaeyoon83/mcp-server-youtube-transcript,kimtaeyoon83/mcp-server-youtube-transcript,Fetch YouTube subtitles and transcripts for AI analysis.,browser-automation,https://github.com/kimtaeyoon83/mcp-server-youtube-transcript,https://github.com/kimtaeyoon83/mcp-server-youtube-transcript,MIT,2024-11-29 04:53:05,2025-12-24 04:07:22,2025-12-24 04:07:22,48.0,,87.0,5.0,20.0,8.0,4.0,542.0,,,,,,10.0,10,True,3.0,,,,,,,
283,subnetmarco/pgmcp,subnetmarco/pgmcp,"Natural language PostgreSQL queries with automatic streaming, read-only safety, and universal database compatibility.",databases,https://github.com/subnetmarco/pgmcp,https://github.com/subnetmarco/pgmcp,,2025-09-16 19:45:03,2025-09-25 18:19:25,2025-09-25 18:19:04,28.0,,61.0,8.0,8.0,1.0,4.0,529.0,2025-09-25 18:20:28,0.3.0,259.0,32.0,1.0,,10,True,3.0,,,,,,,
284,runekaagaard/mcp-alchemy,runekaagaard/mcp-alchemy,"Universal SQLAlchemy-based database integration supporting PostgreSQL, MySQL, MariaDB, SQLite, Oracle, MS SQL Server..",databases,https://github.com/runekaagaard/mcp-alchemy,https://github.com/runekaagaard/mcp-alchemy,MPL-2.0,2024-12-26 14:09:30,2025-08-15 07:18:27,2025-08-15 07:18:25,119.0,,60.0,7.0,14.0,,18.0,403.0,,,,,,6.0,10,True,3.0,,,,,,,
285,cantian-ai/bazi-mcp,cantian-ai/bazi-mcp,Provides comprehensive and accurate Bazi (Chinese Astrology) charting and analysis.,art-and-culture,https://github.com/cantian-ai/bazi-mcp,https://github.com/cantian-ai/bazi-mcp,ISC,2025-04-27 06:48:50,2025-10-11 07:56:23,2025-10-11 07:56:16,44.0,,151.0,6.0,7.0,2.0,1.0,376.0,,,,,,5.0,10,True,3.0,,,,,,,
286,r-huijts/xcode-mcp-server,r-huijts/xcode-mcp-server,"Xcode integration for project management, file operations, and build automation.",developer-tools,https://github.com/r-huijts/xcode-mcp-server,https://github.com/r-huijts/xcode-mcp-server,MIT,2025-01-16 12:15:47,2026-02-02 11:23:41,2026-02-02 11:23:36,73.0,,25.0,4.0,7.0,1.0,6.0,375.0,,,,,,3.0,10,True,3.0,,,,,,,
287,JoshuaRileyDev/app-store-connect-mcp-server,JoshuaRileyDev/app-store-connect-mcp-server,An MCP server to communicate with the App Store Connect API for iOS Developers.,developer-tools,https://github.com/JoshuaRileyDev/app-store-connect-mcp-server,https://github.com/JoshuaRileyDev/app-store-connect-mcp-server,MIT,2024-12-13 18:24:32,2025-09-02 10:27:03,2025-09-02 10:27:02,37.0,,52.0,5.0,16.0,5.0,4.0,323.0,,,,,,3.0,10,True,3.0,,,,,,,
288,sunriseapps/imagesorcery-mcp,sunriseapps/imagesorcery-mcp,ComputerVision-based sorcery of image recognition and editing tools for AI assistants.,multimedia-process,https://github.com/sunriseapps/imagesorcery-mcp,https://github.com/sunriseapps/imagesorcery-mcp,MIT,2025-05-12 13:14:08,2026-05-19 08:19:25,2026-05-19 08:16:21,171.0,3.0,46.0,2.0,5.0,1.0,9.0,312.0,,,,,,2.0,10,True,1.0,,,,,,,
289,open-strategy-partners/osp_marketing_tools,open-strategy-partners/osp_marketing_tools,"A suite of marketing tools from Open Strategy Partners including writing style, editing codes, and product marketing..",marketing,https://github.com/open-strategy-partners/osp_marketing_tools,https://github.com/open-strategy-partners/osp_marketing_tools,CC-BY-SA-4.0,2025-01-16 14:43:32,2025-04-23 11:40:18,2025-04-23 11:40:17,81.0,,44.0,4.0,6.0,4.0,,265.0,,,,,,5.0,10,False,2.0,,,,,,,
290,hannesrudolph/mcp-ragdocs,hannesrudolph/mcp-ragdocs,"An MCP server implementation that provides tools for retrieving and processing documentation through vector search,..",knowledge-and-memory,https://github.com/hannesrudolph/mcp-ragdocs,https://github.com/hannesrudolph/mcp-ragdocs,MIT,2024-12-13 22:40:03,2025-07-18 06:59:53,2025-07-18 06:59:53,16.0,,24.0,3.0,4.0,,,261.0,,,,,,4.0,10,True,3.0,3.0,3.0,,,,,
291,mhmzdev/figma-flutter-mcp,mhmzdev/figma-flutter-mcp,Provide coding agents direct access to Figma data to help them write Flutter code for building apps including assets..,developer-tools,https://github.com/mhmzdev/figma-flutter-mcp,https://github.com/mhmzdev/figma-flutter-mcp,MIT,2025-08-20 05:20:47,2026-02-27 04:33:45,2026-02-27 04:33:45,149.0,2.0,21.0,2.0,40.0,7.0,1.0,235.0,2025-09-20 14:18:04,0.3.3,,,11.0,3.0,10,True,3.0,,,,,,,
292,YuChenSSR/mindmap-mcp-server,YuChenSSR/mindmap-mcp-server,A Model Context Protocol (MCP) server for generating a beautiful interactive mindmap.,developer-tools,https://github.com/YuChenSSR/mindmap-mcp-server,https://github.com/YuChenSSR/mindmap-mcp-server,MIT,2025-03-19 12:05:58,2025-05-20 12:49:06,2025-05-20 12:48:52,27.0,,21.0,1.0,3.0,3.0,3.0,231.0,,,,,,,10,True,3.0,5.0,5.0,,,,,
293,hellokaton/unsplash-mcp-server,hellokaton/unsplash-mcp-server,A MCP server for Unsplash image search.,search-data-extraction,https://github.com/hellokaton/unsplash-mcp-server,https://github.com/hellokaton/unsplash-mcp-server,MIT,2025-03-18 08:42:50,2026-04-23 04:29:36,2026-04-23 04:29:36,30.0,3.0,21.0,2.0,7.0,2.0,6.0,219.0,,,,,,5.0,10,True,3.0,,,,,,,
294,the-momentum/apple-health-mcp-server,the-momentum/apple-health-mcp-server,An MCP server that provides access to exported data from Apple Health. Data analytics included.,bio,https://github.com/the-momentum/apple-health-mcp-server,https://github.com/the-momentum/apple-health-mcp-server,MIT,2025-07-02 15:46:44,2026-02-10 07:22:28,2026-02-10 07:22:24,39.0,,15.0,4.0,27.0,6.0,9.0,191.0,2025-10-22 11:50:42,0.1.0,,,1.0,5.0,10,True,3.0,,,,,,,
295,traceloop/opentelemetry-mcp-server,traceloop/opentelemetry-mcp-server,"An MCP server for connecting to any OpenTelemetry backend (Datadog, Grafana, Dynatrace, Traceloop, etc.).",developer-tools,https://github.com/traceloop/opentelemetry-mcp-server,https://github.com/traceloop/opentelemetry-mcp-server,Apache-2.0,2025-11-02 14:50:22,2026-04-20 06:39:43,2026-04-06 17:44:30,17.0,1.0,18.0,3.0,34.0,7.0,1.0,187.0,2026-02-08 12:38:28,0.2.2,,,2.0,5.0,10,True,3.0,,,,,,,
296,langfuse/mcp-server-langfuse,langfuse/mcp-server-langfuse,MCP server to access and manage LLM application prompts created with Langfuse) Prompt Management.,developer-tools,https://github.com/langfuse/mcp-server-langfuse,https://github.com/langfuse/mcp-server-langfuse,MIT,2025-02-15 11:58:06,2025-02-16 14:03:25,2025-02-15 23:13:01,9.0,,35.0,2.0,10.0,7.0,3.0,168.0,2025-02-15 21:24:41,0.0.1,,,2.0,,10,False,3.0,,,,,,,
297,pi22by7/In-Memoria,pi22by7/In-Memoria,Persistent intelligence infrastructure for agentic development that gives AI coding assistants cumulative memory and..,knowledge-and-memory,https://github.com/pi22by7/In-Memoria,https://github.com/pi22by7/In-Memoria,MIT,2025-08-16 06:53:05,2025-12-23 15:59:37,2025-12-23 15:59:37,115.0,,29.0,1.0,9.0,2.0,23.0,168.0,,,,,,3.0,10,True,3.0,1.0,1.0,,,,,
298,34892002/bilibili-mcp-js,34892002/bilibili-mcp-js,A MCP server that supports searching for Bilibili content. Provides LangChain integration examples and test scripts.,browser-automation,https://github.com/34892002/bilibili-mcp-js,https://github.com/34892002/bilibili-mcp-js,MIT,2025-03-24 10:27:50,2026-03-30 01:18:26,2026-03-30 01:18:25,42.0,2.0,27.0,3.0,3.0,1.0,6.0,167.0,,,,,,3.0,10,True,3.0,,,,,,,
299,andybrandt/mcp-simple-pubmed,andybrandt/mcp-simple-pubmed,MCP to search and read medical / life sciences papers from PubMed.,search-data-extraction,https://github.com/andybrandt/mcp-simple-pubmed,https://github.com/andybrandt/mcp-simple-pubmed,MIT,2024-12-11 14:53:03,2026-03-19 13:33:40,2026-03-19 13:33:14,44.0,5.0,30.0,2.0,6.0,,6.0,167.0,,,,,,7.0,10,True,3.0,,,,,,,
300,aliyun/alibabacloud-tablestore-mcp-server,aliyun/alibabacloud-tablestore-mcp-server,"MCP service for Tablestore, features include adding documents, semantic search for documents based on vectors and..",databases,https://github.com/aliyun/alibabacloud-tablestore-mcp-server,https://github.com/aliyun/alibabacloud-tablestore-mcp-server,Apache-2.0,2025-03-19 03:10:51,2026-03-19 11:23:44,2026-03-19 09:46:53,28.0,1.0,41.0,4.0,4.0,1.0,5.0,156.0,,,,,,3.0,10,True,3.0,,,,,,,
301,Seym0n/tiktok-mcp,Seym0n/tiktok-mcp,Interact with TikTok videos.,other-tools-and-integrations,https://github.com/Seym0n/tiktok-mcp,https://github.com/Seym0n/tiktok-mcp,MIT,2025-03-13 12:23:46,2026-02-27 20:05:47,2026-02-27 20:05:42,14.0,5.0,24.0,4.0,2.0,,1.0,155.0,2026-02-27 20:06:23,2.2.0,67.0,4.0,3.0,2.0,10,True,3.0,,,,,,,
