,name,github_id,description,category,github_url,homepage,license,created_at,updated_at,last_commit_pushed_at,commit_count,recent_commit_count,fork_count,watchers_count,pr_count,open_issue_count,closed_issue_count,star_count,latest_stable_release_published_at,latest_stable_release_number,github_release_downloads,monthly_downloads,release_count,contributor_count,projectrank,show,projectrank_placing,dependent_project_count,github_dependent_project_count,trending,updated_github_id,pypi_id,pypi_url,pypi_monthly_downloads
0,netdata/netdata,netdata/netdata,"Discovery, exploration, reporting and root cause analysis using all observability data, including metrics, logs,..",monitoring,https://github.com/netdata/netdata,https://github.com/netdata/netdata,GPL-3.0,2013-06-17 18:39:10,2026-05-19 11:13:49,2026-05-19 11:13:48,22220.0,540.0,6283.0,1336.0,13675.0,163.0,8065.0,78866.0,2026-04-27 17:04:47,2.10.3,1460497.0,21477.0,100.0,677.0,36,True,1.0,,,,,,,
1,PrefectHQ/fastmcp,PrefectHQ/fastmcp,A high-level framework for building MCP servers in Python.,other-tools-and-integrations,https://github.com/PrefectHQ/fastmcp,https://github.com/PrefectHQ/fastmcp,Apache-2.0,2024-11-30 01:47:40,2026-05-19 03:14:06,2026-05-15 15:49:08,3466.0,443.0,2011.0,115.0,2314.0,224.0,1398.0,25223.0,2026-05-15 15:49:51,3.3.1,,,100.0,243.0,35,True,1.0,15640.0,15640.0,,,,,
2,pydantic/pydantic-ai,pydantic/pydantic-ai,Run Python code in a secure sandbox via MCP tool calls.,code-execution,https://github.com/pydantic/pydantic-ai,https://github.com/pydantic/pydantic-ai,MIT,2024-06-21 15:55:04,2026-05-20 00:29:38,2026-05-19 19:12:13,2066.0,319.0,2060.0,109.0,3074.0,382.0,1838.0,17148.0,2026-05-19 00:56:30,1.98.0,,,100.0,445.0,35,True,1.0,4736.0,4736.0,,,,,
3,topoteretes/cognee,topoteretes/cognee,Memory manager for AI apps and Agents using various graph and vector stores and allowing ingestion from 30+ data..,knowledge-and-memory,https://github.com/topoteretes/cognee,https://github.com/topoteretes/cognee,Apache-2.0,2023-08-16 16:16:33,2026-05-19 20:18:28,2026-05-18 20:27:58,7573.0,1838.0,1814.0,71.0,2190.0,35.0,460.0,17348.0,2026-05-16 18:51:18,1.1.0,,,100.0,159.0,32,True,1.0,147.0,147.0,1.0,,,,
4,bytedance/UI-TARS-desktop,bytedance/UI-TARS-desktop,"Browser automation capabilities using Puppeteer, both support local and remote browser connection.",browser-automation,https://github.com/bytedance/UI-TARS-desktop,https://github.com/bytedance/UI-TARS-desktop,Apache-2.0,2025-01-19 09:04:43,2026-05-18 02:55:49,2026-05-18 02:55:46,1109.0,9.0,3473.0,263.0,1306.0,317.0,217.0,34767.0,2025-11-04 16:10:39,0.3.0,335403.0,20962.0,38.0,49.0,31,True,1.0,58.0,58.0,,,,,
5,screenpipe/screenpipe,screenpipe/screenpipe,"Local-first system capturing screen/audio with timestamped indexing, SQL/embedding storage, semantic search, LLM-..",other-tools-and-integrations,https://github.com/screenpipe/screenpipe,https://github.com/screenpipe/screenpipe,,2024-06-19 13:23:56,2026-05-20 00:10:28,2026-05-19 23:46:16,9260.0,3529.0,1713.0,105.0,1750.0,50.0,1530.0,18791.0,2026-05-18 01:57:57,app-v2.4.234,4904.0,2452.0,100.0,120.0,31,True,1.0,3.0,3.0,,,,,
6,microsoft/markitdown,microsoft/markitdown,MCP tool access to MarkItDown -- a library that converts many file formats (local or remote) to Markdown for LLM..,file-systems,https://github.com/microsoft/markitdown,https://github.com/microsoft/markitdown,MIT,2024-11-13 19:56:40,2026-04-20 17:52:20,2026-04-20 17:52:17,307.0,6.0,8335.0,420.0,613.0,366.0,95.0,123845.0,2026-02-20 19:49:39,0.1.5,,,18.0,79.0,30,True,1.0,3048.0,3048.0,,,,,
7,github/github-mcp-server,github/github-mcp-server,"Official GitHub server for integration with repository management, PRs, issues, and more.",version-control,https://github.com/github/github-mcp-server,https://github.com/github/github-mcp-server,MIT,2025-03-04 16:42:04,2026-05-19 17:40:20,2026-05-19 17:40:19,852.0,118.0,4084.0,329.0,1297.0,183.0,704.0,29978.0,2026-05-18 15:07:31,1.0.5,432632.0,33279.0,63.0,121.0,30,True,1.0,,,,,,,
8,Skyvern-AI/skyvern,Skyvern-AI/skyvern,"Automates browser-based workflows using LLMs and computer vision navigate pages, fill forms, extract data, handle..",browser-automation,https://github.com/Skyvern-AI/skyvern,https://github.com/Skyvern-AI/skyvern,AGPL-3.0,2024-02-28 15:45:19,2026-05-20 00:24:39,2026-05-19 23:31:11,4855.0,912.0,1998.0,103.0,5638.0,40.0,312.0,21658.0,2026-05-10 02:06:38,1.0.36,,,100.0,87.0,30,True,1.0,46.0,46.0,,,,,
9,mindsdb/mindsdb,mindsdb/mindsdb,Connect and unify data across various platforms and databases with MindsDB as a single MCP server.,aggregators,https://github.com/mindsdb/minds-platform,https://github.com/mindsdb/minds-platform,,2018-08-02 17:56:45,2026-05-17 09:54:04,2026-05-15 14:31:19,20565.0,284.0,6192.0,436.0,7451.0,54.0,4373.0,39192.0,2026-04-23 07:11:44,26.1.0,,,100.0,908.0,29,True,1.0,,,,mindsdb/minds-platform,,,
10,oraios/serena,oraios/serena,A fully-featured coding agent that relies on symbolic code operations by using language servers.,coding-agents,https://github.com/oraios/serena,https://github.com/oraios/serena,MIT,2025-03-23 22:35:24,2026-05-19 22:03:17,2026-05-18 20:15:02,2894.0,706.0,1623.0,81.0,690.0,70.0,624.0,24394.0,2026-05-18 20:16:34,1.5.1,1466.0,122.0,11.0,180.0,29,True,1.0,,,,,,,
11,PipedreamHQ/pipedream,PipedreamHQ/pipedream,"Connect with 2,500 APIs with 8,000+ prebuilt tools, and manage servers for your users, in your own app.",aggregators,https://github.com/PipedreamHQ/pipedream,https://github.com/PipedreamHQ/pipedream,,2020-01-22 00:28:31,2026-05-20 00:17:12,2026-05-20 00:17:03,14568.0,460.0,5642.0,276.0,7600.0,4124.0,8946.0,11371.0,,,,,,287.0,29,True,1.0,14.0,14.0,,,,,
12,microsoft/playwright-mcp,microsoft/playwright-mcp,"Official Microsoft Playwright MCP server, enabling LLMs to interact with web pages through structured accessibility..",browser-automation,https://github.com/microsoft/playwright-mcp,https://github.com/microsoft/playwright-mcp,Apache-2.0,2025-03-21 17:48:36,2026-05-12 18:18:54,2026-05-12 18:18:51,551.0,69.0,2644.0,123.0,773.0,1.0,840.0,32734.0,2026-05-07 23:08:37,0.0.75,67808.0,4843.0,65.0,68.0,28,True,2.0,,,,,,,
13,elie222/inbox-zero,elie222/inbox-zero,An MCP server for Inbox Zero. Adds functionality on top of Gmail like finding out which emails you need to reply to or..,communication,https://github.com/elie222/inbox-zero,https://github.com/elie222/inbox-zero,,2023-07-12 15:34:57,2026-05-19 22:25:43,2026-05-19 13:28:03,10247.0,999.0,1324.0,46.0,2476.0,83.0,149.0,10726.0,2026-05-18 11:42:25,2.30.0,168.0,28.0,9.0,64.0,28,True,1.0,,,,,,,
14,awslabs/mcp,awslabs/mcp,AWS MCP servers for seamless integration with AWS services and resources.,cloud-platforms,https://github.com/awslabs/mcp,https://github.com/awslabs/mcp,Apache-2.0,2025-03-21 00:39:00,2026-05-19 20:02:26,2026-05-19 07:34:17,1552.0,269.0,1502.0,74.0,2959.0,161.0,443.0,9090.0,2026-05-18 15:13:09,2026.05.20260518145256,,,100.0,272.0,28,True,1.0,4.0,4.0,,,,,
15,IvanMurzak/Unity-MCP,IvanMurzak/Unity-MCP,MCP Server for Unity Editor and for a game made with Unity.,gaming,https://github.com/IvanMurzak/Unity-MCP,https://github.com/IvanMurzak/Unity-MCP,Apache-2.0,2025-04-02 09:57:01,2026-05-19 23:33:54,2026-05-19 23:33:31,2839.0,464.0,259.0,26.0,414.0,43.0,288.0,2798.0,2026-05-19 23:29:55,0.72.2,98637.0,16439.0,100.0,20.0,28,True,1.0,,,,,,,
16,modelcontextprotocol/servers,modelcontextprotocol/servers,MCP server that exercises all the features of the MCP protocol.,other-tools-and-integrations,https://github.com/modelcontextprotocol/servers,https://github.com/modelcontextprotocol/servers,,2024-11-19 01:10:17,2026-05-17 17:59:27,2026-05-17 17:59:27,4102.0,40.0,10662.0,616.0,3053.0,282.0,797.0,85938.0,2026-01-27 12:11:26,2026.1.26,,,24.0,1028.0,27,True,1.0,,,,,,,
17,upstash/context7,upstash/context7,Up-to-date code documentation for LLMs and AI code editors.,knowledge-and-memory,https://github.com/upstash/context7,https://github.com/upstash/context7,MIT,2025-03-26 23:40:39,2026-05-19 14:12:09,2026-05-18 19:33:11,817.0,126.0,2637.0,155.0,559.0,125.0,1909.0,55660.0,2026-05-11 19:51:39,ctx7@0.4.2,1065.0,81.0,74.0,119.0,27,True,1.0,,,,,,,
18,googleapis/genai-toolbox,googleapis/genai-toolbox,"Open source MCP server specializing in easy, fast, and secure tools for Databases.",databases,https://github.com/googleapis/mcp-toolbox,https://github.com/googleapis/mcp-toolbox,Apache-2.0,2024-06-07 20:52:54,2026-05-20 00:29:47,2026-05-19 23:04:58,1879.0,409.0,1535.0,94.0,2681.0,141.0,426.0,15286.0,2026-05-07 19:18:34,1.2.0,,,41.0,126.0,27,True,1.0,2.0,2.0,,googleapis/mcp-toolbox,,,
19,txn2/kubefwd,txn2/kubefwd,"Kubernetes bulk port forwarding with service discovery, /etc/hosts management, traffic monitoring, and pod log..",cloud-platforms,https://github.com/txn2/kubefwd,https://github.com/txn2/kubefwd,Apache-2.0,2018-08-05 22:05:58,2026-05-19 21:13:31,2026-05-19 19:46:32,887.0,54.0,223.0,30.0,295.0,,198.0,4109.0,2026-04-22 08:23:49,1.25.14,398166.0,4424.0,62.0,49.0,27,True,1.0,4.0,4.0,,,,,
20,mckinsey/vizro,mckinsey/vizro,Tools and templates to create validated and maintainable data charts and dashboards.,data-science-tools,https://github.com/mckinsey/vizro,https://github.com/mckinsey/vizro,Apache-2.0,2023-09-04 11:11:33,2026-05-19 23:23:56,2026-05-19 12:35:36,1206.0,94.0,264.0,28.0,1449.0,49.0,235.0,3693.0,2026-05-18 12:32:25,0.1.56,,,85.0,44.0,27,True,1.0,82.0,82.0,,,,,
21,CodeGraphContext/CodeGraphContext,CodeGraphContext/CodeGraphContext,An MCP server that indexes local code into a graph database to provide context to AI assistants with a graphical code..,coding-agents,https://github.com/CodeGraphContext/CodeGraphContext,https://github.com/CodeGraphContext/CodeGraphContext,MIT,2025-08-16 19:20:31,2026-05-20 00:05:17,2026-05-20 00:05:14,1234.0,496.0,582.0,13.0,428.0,124.0,407.0,3332.0,2026-05-07 18:16:14,0.4.7,748.0,249.0,17.0,106.0,27,True,1.0,5.0,5.0,,,,,
22,grafana/mcp-grafana,grafana/mcp-grafana,"Search dashboards, investigate incidents and query datasources in your Grafana instance.",monitoring,https://github.com/grafana/mcp-grafana,https://github.com/grafana/mcp-grafana,Apache-2.0,2024-12-24 15:44:23,2026-05-19 21:58:18,2026-05-19 13:18:03,609.0,160.0,351.0,114.0,628.0,68.0,186.0,3021.0,2026-05-08 11:14:21,0.14.0,104860.0,6553.0,50.0,85.0,27,True,2.0,5.0,5.0,,,,,
23,taylorwilsdon/google_workspace_mcp,taylorwilsdon/google_workspace_mcp,"Comprehensive Google Workspace MCP server with full support for Google Calendar, Drive, Gmail, and Docs, Forms, Chats,..",workplace-and-productivity,https://github.com/taylorwilsdon/google_workspace_mcp,https://github.com/taylorwilsdon/google_workspace_mcp,MIT,2025-04-27 18:31:13,2026-05-19 22:47:45,2026-05-19 22:47:45,2297.0,879.0,745.0,16.0,498.0,49.0,249.0,2429.0,2026-05-17 18:42:14,1.21.0,6422.0,535.0,86.0,124.0,27,True,1.0,,,,,,,
24,apify/apify-mcp-server,apify/apify-mcp-server,"Use 3,000+ pre-built cloud tools, known as Actors, to extract data from websites, e-commerce, social media, search..",other-tools-and-integrations,https://github.com/apify/apify-mcp-server,https://github.com/apify/apify-mcp-server,MIT,2025-01-02 15:43:09,2026-05-19 15:24:37,2026-05-19 12:54:17,801.0,269.0,165.0,15.0,550.0,104.0,212.0,1240.0,2026-05-19 12:55:53,0.10.6,5420.0,492.0,100.0,30.0,27,True,1.0,10.0,10.0,,,,,
25,sooperset/mcp-atlassian,sooperset/mcp-atlassian,"MCP server for Atlassian products (Confluence and Jira). Supports Confluence Cloud, Jira Cloud, and Jira Server/Data..",support-and-service-management,https://github.com/sooperset/mcp-atlassian,https://github.com/sooperset/mcp-atlassian,MIT,2024-12-03 09:25:20,2026-04-10 09:37:10,2026-04-10 09:37:07,560.0,137.0,1142.0,21.0,756.0,189.0,283.0,5222.0,2026-04-10 07:31:45,0.21.1,,,70.0,96.0,26,True,1.0,10.0,10.0,,,,,
26,containers/kubernetes-mcp-server,containers/kubernetes-mcp-server,powerful Kubernetes MCP server with additional support for OpenShift. Besides providing CRUD operations for **any**..,cloud-platforms,https://github.com/containers/kubernetes-mcp-server,https://github.com/containers/kubernetes-mcp-server,Apache-2.0,2025-02-11 02:57:36,2026-05-19 11:35:08,2026-05-18 14:12:01,893.0,225.0,294.0,12.0,958.0,38.0,154.0,1603.0,2026-05-05 12:23:02,0.0.62,52601.0,3506.0,62.0,54.0,26,True,2.0,,,,,,,
27,ArcadeData/arcadedb,ArcadeData/arcadedb,"Built-in MCP server for ArcadeDB, a multi-model database (graph, document, key-value, time-series, vector) with SQL,..",databases,https://github.com/ArcadeData/arcadedb,https://github.com/ArcadeData/arcadedb,Apache-2.0,2021-08-16 16:01:29,2026-05-19 20:50:46,2026-05-19 18:38:10,6317.0,1216.0,105.0,16.0,2446.0,31.0,1477.0,887.0,2026-05-11 21:26:39,26.5.1,9447.0,168.0,54.0,44.0,26,True,1.0,1.0,1.0,,,,,
28,public-ui/kolibri,public-ui/kolibri,"Streaming KoliBri MCP server (NPM: @public-ui/mcp) delivering 200+ guaranteed accessible web component samples, specs,..",developer-tools,https://github.com/public-ui/kolibri,https://github.com/public-ui/kolibri,EUPL-1.2,2022-10-12 06:16:11,2026-05-19 21:49:40,2026-05-19 17:50:05,12908.0,1252.0,46.0,2.0,7928.0,228.0,1941.0,262.0,2026-04-28 14:14:23,4.1.4,,,100.0,39.0,26,True,1.0,129.0,129.0,,,,,
29,GLips/Figma-Context-MCP,GLips/Figma-Context-MCP,Provide coding agents direct access to Figma data to help them one-shot design implementation.,developer-tools,https://github.com/GLips/Figma-Context-MCP,https://github.com/GLips/Figma-Context-MCP,MIT,2025-02-13 02:55:06,2026-04-30 00:17:20,2026-04-30 00:16:55,232.0,59.0,1152.0,60.0,183.0,12.0,164.0,14804.0,2026-04-20 21:12:06,0.11.0,,,25.0,26.0,25,True,1.0,,,,,,,
30,punkpeye/fastmcp,punkpeye/fastmcp,A high-level framework for building MCP servers in TypeScript.,other-tools-and-integrations,https://github.com/punkpeye/fastmcp,https://github.com/punkpeye/fastmcp,MIT,2024-12-27 02:12:31,2026-05-04 23:07:01,2026-05-04 23:07:01,288.0,13.0,262.0,18.0,135.0,38.0,91.0,3117.0,2026-04-24 17:12:20,4.0.1,,,100.0,59.0,25,True,2.0,2202.0,2202.0,,,,,
31,DeusData/codebase-memory-mcp,DeusData/codebase-memory-mcp,High-performance code intelligence MCP server. Indexes codebases into a persistent knowledge graph average repo in..,developer-tools,https://github.com/DeusData/codebase-memory-mcp,https://github.com/DeusData/codebase-memory-mcp,MIT,2026-02-24 22:01:00,2026-05-16 05:43:01,2026-05-10 19:10:27,585.0,585.0,272.0,15.0,157.0,93.0,92.0,2448.0,2026-05-04 22:20:50,0.6.1,42208.0,14069.0,32.0,31.0,25,True,1.0,,,,,,,
32,korotovsky/slack-mcp-server,korotovsky/slack-mcp-server,The most powerful MCP server for Slack Workspaces.,communication,https://github.com/korotovsky/slack-mcp-server,https://github.com/korotovsky/slack-mcp-server,MIT,2025-04-12 11:31:34,2026-05-14 22:52:35,2026-05-14 22:51:29,445.0,84.0,313.0,8.0,183.0,22.0,92.0,1610.0,2026-05-14 22:55:09,1.3.0,9730.0,748.0,31.0,56.0,25,True,1.0,39.0,39.0,,,,,
33,aymericzip/intlayer,aymericzip/intlayer,"A MCP Server that enhance your IDE with AI-powered assistance for Intlayer i18n / CMS tool: smart CLI access, access..",command-line,https://github.com/aymericzip/intlayer,https://github.com/aymericzip/intlayer,Apache-2.0,2024-03-24 20:14:24,2026-05-19 23:34:33,2026-05-19 23:33:20,6065.0,1116.0,115.0,4.0,233.0,13.0,181.0,737.0,2026-05-18 21:16:05,8.9.8,34.0,1.0,100.0,50.0,25,True,1.0,86.0,86.0,,,,,
34,planetscale/cli,planetscale/cli,The CLI for PlanetScale Database.,databases,https://github.com/planetscale/cli,https://github.com/planetscale/cli,Apache-2.0,2020-12-01 17:15:55,2026-05-19 18:56:01,2026-05-19 18:42:32,2669.0,149.0,59.0,22.0,1108.0,6.0,137.0,652.0,2026-05-19 19:06:30,0.284.0,551745.0,19025.0,100.0,61.0,25,True,1.0,,,,,,,
35,eyaltoledano/claude-task-master,eyaltoledano/claude-task-master,"AI-powered task management system for AI-driven development. Features PRD parsing, task expansion, multi-provider..",developer-tools,https://github.com/eyaltoledano/claude-task-master,https://github.com/eyaltoledano/claude-task-master,,2025-03-04 18:54:54,2026-04-28 13:27:12,2026-04-23 12:07:23,1216.0,4.0,2502.0,153.0,872.0,152.0,485.0,27185.0,2026-03-31 17:49:05,task-master-ai@0.43.1,,,92.0,56.0,24,True,1.0,12.0,12.0,,,,,
36,mrexodia/ida-pro-mcp,mrexodia/ida-pro-mcp,"MCP server for IDA Pro, allowing you to perform binary analysis with AI assistants. This plugin implement..",security,https://github.com/mrexodia/ida-pro-mcp,https://github.com/mrexodia/ida-pro-mcp,MIT,2025-03-25 22:23:41,2026-05-14 21:23:31,2026-05-14 21:23:22,497.0,198.0,992.0,49.0,184.0,41.0,178.0,8663.0,2025-10-06 13:28:26,1.4.0,,,3.0,59.0,24,True,1.0,2.0,2.0,,,,,
37,baserow/baserow,baserow/baserow,"Baserow database integration with table search, list, and row create, read, update, and delete capabilities.",databases,https://github.com/baserow/baserow,https://github.com/baserow/baserow,,2020-07-20 09:32:04,2026-05-19 21:42:39,2026-05-19 11:05:00,6986.0,309.0,597.0,38.0,939.0,1141.0,3306.0,4868.0,2026-04-28 19:48:09,2.2.2,,,17.0,80.0,24,True,1.0,,,,,,,
38,kubestellar/console,kubestellar/console,"Multi-cluster Kubernetes dashboard with built-in MCP server (kc-agent) for AI-assisted operations, real-time..",cloud-platforms,https://github.com/kubestellar/console,https://github.com/kubestellar/console,Apache-2.0,2026-01-16 06:32:19,2026-05-19 23:53:38,2026-05-19 23:53:36,7839.0,6505.0,106.0,1.0,7667.0,7.0,7258.0,104.0,2026-05-17 08:57:12,0.3.27,2741.0,685.0,100.0,73.0,24,True,2.0,,,,,,,
39,Klavis-AI/klavis,Klavis-AI/klavis,Extract and convert YouTube video information.,other-tools-and-integrations,https://github.com/Klavis-AI/klavis,https://github.com/Klavis-AI/klavis,Apache-2.0,2025-04-14 07:53:36,2026-05-19 22:40:45,2026-05-09 02:52:08,1326.0,122.0,541.0,163.0,1593.0,21.0,28.0,5739.0,2026-01-29 17:43:48,python-v2.20.0,,,79.0,40.0,23,True,2.0,,,,,,,
40,mobile-next/mobile-mcp,mobile-next/mobile-mcp,"MCP Server for Android/iOS application and device automation, development and app scraping...",developer-tools,https://github.com/mobile-next/mobile-mcp,https://github.com/mobile-next/mobile-mcp,Apache-2.0,2025-03-28 16:21:06,2026-05-17 19:57:27,2026-05-17 19:55:08,327.0,69.0,431.0,43.0,168.0,34.0,99.0,4957.0,2026-05-16 17:21:45,0.0.55,,,45.0,23.0,23,True,1.0,7.0,7.0,,,,,
41,supabase-community/supabase-mcp,supabase-community/supabase-mcp,Official Supabase MCP server to connect AI assistants directly with your Supabase project and allows them to perform..,databases,https://github.com/supabase-community/supabase-mcp,https://github.com/supabase-community/supabase-mcp,Apache-2.0,2024-12-20 23:52:42,2026-05-15 21:05:50,2026-05-15 21:05:16,386.0,32.0,351.0,25.0,179.0,64.0,44.0,2697.0,2026-05-01 20:49:32,mcp-server-supabase-v0.8.1,,,35.0,18.0,23,True,1.0,237.0,237.0,,,,,
42,mediar-ai/terminator,mediar-ai/terminator,"Desktop GUI automation using accessibility APIs. Control Windows, macOS, and Linux applications without vision models..",coding-agents,https://github.com/mediar-ai/terminator,https://github.com/mediar-ai/terminator,MIT,2025-04-11 02:48:04,2026-04-21 23:43:01,2026-04-21 23:42:59,2940.0,11.0,205.0,18.0,322.0,1.0,152.0,1480.0,2026-04-05 17:29:30,0.24.32,1590.0,265.0,100.0,15.0,23,True,2.0,,,,,,,
43,Flux159/mcp-server-kubernetes,Flux159/mcp-server-kubernetes,"Typescript implementation of Kubernetes cluster operations for pods, deployments, services.",cloud-platforms,https://github.com/Flux159/mcp-server-kubernetes,https://github.com/Flux159/mcp-server-kubernetes,MIT,2024-12-08 00:01:28,2026-05-18 19:19:36,2026-05-14 22:58:35,798.0,34.0,241.0,11.0,206.0,10.0,91.0,1394.0,2026-05-14 22:51:31,3.6.2,1511.0,107.0,72.0,43.0,23,True,2.0,19.0,19.0,,,,,
44,genomoncology/biomcp,genomoncology/biomcp,"Biomedical research MCP server providing access to PubMed, ClinicalTrials.gov, and MyVariant.info.",bio,https://github.com/genomoncology/biomcp,https://github.com/genomoncology/biomcp,MIT,2025-04-01 21:44:02,2026-05-01 18:35:36,2026-05-01 16:56:46,1251.0,1096.0,98.0,7.0,194.0,,39.0,508.0,2026-05-01 18:17:22,0.8.22,5488.0,422.0,59.0,10.0,23,True,1.0,,,,,,,
45,mickael-kerjean/filestash,mickael-kerjean/filestash,"Remote Storage Access: SFTP, S3, FTP, SMB, NFS, WebDAV, GIT, FTPS, gcloud, azure blob, sharepoint, etc.",file-systems,https://github.com/mickael-kerjean/filestash,https://github.com/mickael-kerjean/filestash,AGPL-3.0,2017-06-13 05:34:14,2026-05-19 05:51:24,2026-05-19 05:51:20,2332.0,155.0,963.0,117.0,252.0,75.0,629.0,14212.0,,,,,,81.0,22,True,2.0,4.0,4.0,,,,,
46,cloudflare/mcp-server-cloudflare,cloudflare/mcp-server-cloudflare,"Integration with Cloudflare services including Workers, KV, R2, and D1.",cloud-platforms,https://github.com/cloudflare/mcp-server-cloudflare,https://github.com/cloudflare/mcp-server-cloudflare,Apache-2.0,2024-11-27 22:07:30,2026-04-30 14:50:05,2026-04-30 14:49:28,356.0,21.0,390.0,40.0,260.0,33.0,76.0,3756.0,2026-04-30 14:50:58,workers-bindings@0.4.7,,,100.0,38.0,22,True,2.0,14.0,14.0,,,,,
47,blazickjp/arxiv-mcp-server,blazickjp/arxiv-mcp-server,Search ArXiv research papers.,search-data-extraction,https://github.com/blazickjp/arxiv-mcp-server,https://github.com/blazickjp/arxiv-mcp-server,Apache-2.0,2024-11-29 16:34:00,2026-05-18 18:00:11,2026-05-18 18:00:09,133.0,45.0,213.0,7.0,47.0,2.0,46.0,2748.0,2026-04-26 04:03:58,0.5.0,64.0,64.0,2.0,15.0,22,True,1.0,21.0,21.0,,,,,
48,zinja-coder/jadx-ai-mcp,zinja-coder/jadx-ai-mcp,JADX-AI-MCP is a plugin and MCP Server for the JADX decompiler that integrates directly with Model Context Protocol..,security,https://github.com/zinja-coder/jadx-ai-mcp,https://github.com/zinja-coder/jadx-ai-mcp,Apache-2.0,2025-04-07 17:28:54,2026-04-20 08:13:17,2026-04-20 08:13:16,232.0,16.0,194.0,7.0,42.0,9.0,43.0,2051.0,2026-03-29 16:31:31,6.3.0,46527.0,3579.0,27.0,6.0,22,True,1.0,,,,,,,
49,mbailey/voicemode,mbailey/voicemode,"Complete voice interaction server supporting speech-to-text, text-to-speech, and real-time voice conversations through..",text-to-speech,https://github.com/mbailey/voicemode,https://github.com/mbailey/voicemode,MIT,2025-06-08 16:16:19,2026-05-19 21:04:03,2026-05-19 05:01:45,1866.0,330.0,164.0,8.0,324.0,28.0,79.0,1188.0,2026-04-21 12:27:54,8.6.1,,,100.0,20.0,22,True,1.0,,,,,,,
50,safedep/vet,safedep/vet,vet-mcp checks open source packageslike those suggested by AI coding toolsfor vulnerabilities and malicious code. It..,security,https://github.com/safedep/vet,https://github.com/safedep/vet,Apache-2.0,2022-12-30 03:39:03,2026-05-15 12:03:53,2026-05-15 12:03:50,847.0,50.0,96.0,15.0,487.0,81.0,145.0,1041.0,2026-05-14 10:29:32,1.17.2,145199.0,3629.0,94.0,31.0,22,True,1.0,1.0,1.0,,,,,
51,TencentCloudBase/CloudBase-AI-ToolKit,TencentCloudBase/CloudBase-AI-ToolKit,One-stop backend services for WeChat Mini-Programs and full-stack apps. Provides specialized MCP tools for serverless..,cloud-platforms,https://github.com/TencentCloudBase/CloudBase-MCP,https://github.com/TencentCloudBase/CloudBase-MCP,MIT,2025-05-23 08:31:26,2026-05-19 08:41:06,2026-05-19 06:51:04,1585.0,737.0,125.0,15.0,517.0,10.0,189.0,1013.0,2026-05-19 06:53:13,2.19.5,,,23.0,16.0,22,True,2.0,5.0,5.0,,TencentCloudBase/CloudBase-MCP,,,
52,mihaelamj/cupertino,mihaelamj/cupertino,"Apple Documentation MCP Server. Search Apple developer docs, Swift Evolution proposals, and 600+ sample code projects..",developer-tools,https://github.com/mihaelamj/cupertino,https://github.com/mihaelamj/cupertino,MIT,2025-11-14 10:33:40,2026-05-19 12:52:51,2026-05-18 04:40:22,709.0,553.0,28.0,3.0,400.0,82.0,312.0,753.0,2026-05-13 21:32:49,1.1.0,2931.0,488.0,27.0,9.0,22,True,1.0,,,,,,,
53,wanaku-ai/wanaku,wanaku-ai/wanaku,The Wanaku MCP Router is a SSE-based MCP server that provides an extensible routing engine that allows integrating..,other-tools-and-integrations,https://github.com/wanaku-ai/wanaku,https://github.com/wanaku-ai/wanaku,Apache-2.0,2025-02-01 13:12:59,2026-05-19 01:35:30,2026-05-15 14:13:52,1493.0,346.0,38.0,3.0,757.0,50.0,324.0,112.0,2026-04-10 09:14:10,0.1.0,1324.0,94.0,11.0,21.0,22,True,2.0,,,,,,,
54,wonderwhy-er/DesktopCommanderMCP,wonderwhy-er/DesktopCommanderMCP,A swiss-army-knife that can manage/execute programs and read/write/search/edit code and text files.,command-line,https://github.com/wonderwhy-er/DesktopCommanderMCP,https://github.com/wonderwhy-er/DesktopCommanderMCP,MIT,2024-12-04 08:26:08,2026-05-14 14:25:03,2026-05-14 14:24:59,509.0,39.0,693.0,42.0,248.0,111.0,89.0,6059.0,2026-05-14 14:45:01,0.2.41,,,34.0,33.0,21,True,2.0,,,-1.0,,,,
55,antvis/mcp-server-chart,antvis/mcp-server-chart,A Model Context Protocol server for generating visual charts using AntV.,customer-data-platforms,https://github.com/antvis/mcp-server-chart,https://github.com/antvis/mcp-server-chart,MIT,2025-04-25 09:10:06,2026-05-06 07:58:59,2026-05-06 07:58:56,111.0,8.0,377.0,20.0,130.0,5.0,165.0,4073.0,2026-02-25 03:36:41,0.9.10,,,24.0,23.0,21,True,1.0,13.0,13.0,,,,,
56,brightdata/brightdata-mcp,brightdata/brightdata-mcp,"Discover, extract, and interact with the web - one interface powering automated access across the public internet.",search-data-extraction,https://github.com/brightdata/brightdata-mcp,https://github.com/brightdata/brightdata-mcp,MIT,2025-04-15 10:55:56,2026-04-20 10:59:38,2026-04-20 10:58:36,321.0,38.0,302.0,11.0,81.0,8.0,42.0,2371.0,2026-03-29 16:16:18,2.9.3,,,10.0,16.0,21,True,1.0,17.0,17.0,,,,,
57,CoderGamester/mcp-unity,CoderGamester/mcp-unity,MCP Server for Unity3d Game Engine integration for game development.,gaming,https://github.com/CoderGamester/mcp-unity,https://github.com/CoderGamester/mcp-unity,MIT,2025-03-13 20:41:25,2026-05-17 21:12:56,2026-05-17 21:11:49,271.0,28.0,209.0,16.0,57.0,6.0,72.0,1702.0,2026-04-26 20:25:39,1.3.0,529.0,40.0,8.0,23.0,21,True,2.0,,,,,,,
